context,correct_city,correct_country,correct_continent,correct_lat,correct_lon,correct_geodesic_dist,correct_through_earth_dist,correct_euclidean_dist,correct_answer,reference_city,reference_country,reference_continent,reference_lat,reference_lon,reference_name,name_1,city_1,country_1,continent_1,lat_1,lon_1,name_2,city_2,country_2,continent_2,lat_2,lon_2,name_3,city_3,country_3,continent_3,lat_3,lon_3
Rose lives in Mkokotoni. Rachel lives in Tola. Emily lives in Nowe Miasto Lubawskie. The person who lives closest to Rose is,Nowe Miasto Lubawskie,Poland,Europe,53.4256,19.5878,6848.204599629897,6523.245125540342,62.48732053344903,Emily,Mkokotoni,Tanzania,Africa,-5.88,39.2731,Rose,Rose,Mkokotoni,Tanzania,Africa,-5.88,39.2731,Rachel,Tola,Nicaragua,North America,11.4333,-85.9333,Emily,Nowe Miasto Lubawskie,Poland,Europe,53.4256,19.5878
Andrew lives in Sīāhkal. Maria lives in Zhmerynka. William lives in Luga. The person who lives closest to Andrew is,Zhmerynka,Ukraine,Europe,49.05,28.1,2194.457095595093,2183.6250435545935,24.809375811777286,Maria,Sīāhkal,Iran,Asia,37.1536,49.8711,Andrew,Andrew,Sīāhkal,Iran,Asia,37.1536,49.8711,Maria,Zhmerynka,Ukraine,Europe,49.05,28.1,William,Luga,Russia,Asia,58.7333,29.8167
Emily lives in Cáceres. Frank lives in Seattle. Marco lives in Mapastepec. The person who lives closest to Emily is,Mapastepec,Mexico,North America,15.4411,-92.8916,5217.047750217556,5072.501433283244,47.25413199001755,Marco,Cáceres,Brazil,South America,-16.0711,-57.6789,Emily,Emily,Cáceres,Brazil,South America,-16.0711,-57.6789,Frank,Seattle,United States,North America,47.6211,-122.3244,Marco,Mapastepec,Mexico,North America,15.4411,-92.8916
Brandon lives in Sárospatak. Dean lives in Sochaczew. Luke lives in Curimatá. The person who lives closest to Brandon is,Sochaczew,Poland,Europe,52.2333,20.2333,445.42589011030225,445.3351763056842,4.13507958810952,Dean,Sárospatak,Hungary,Europe,48.3189,21.5661,Brandon,Brandon,Sárospatak,Hungary,Europe,48.3189,21.5661,Dean,Sochaczew,Poland,Europe,52.2333,20.2333,Luke,Curimatá,Brazil,South America,-10.0358,-44.3058
Kyle lives in Jaciara. Bob lives in Limanowa. Grant lives in Turinsk. The person who lives closest to Kyle is,Limanowa,Poland,Europe,49.7006,20.4267,10345.176243702866,9245.506273546058,99.98150655801301,Bob,Jaciara,Brazil,South America,-15.965,-54.9678,Kyle,Kyle,Jaciara,Brazil,South America,-15.965,-54.9678,Bob,Limanowa,Poland,Europe,49.7006,20.4267,Grant,Turinsk,Russia,Asia,58.0333,63.7
George lives in Vicenza. Matt lives in Don Sak. Emily lives in Srebrenik. The person who lives closest to George is,Srebrenik,Bosnia and Herzegovina,Europe,44.7082,18.4883,552.110653769617,551.9379065120161,6.989179789503198,Emily,Vicenza,Italy,Europe,45.55,11.55,George,George,Vicenza,Italy,Europe,45.55,11.55,Matt,Don Sak,Thailand,Asia,9.3168,99.6918,Emily,Srebrenik,Bosnia and Herzegovina,Europe,44.7082,18.4883
William lives in Mandalay. Maria lives in Phuket. Ian lives in Delicias. The person who lives closest to William is,Phuket,Thailand,Asia,7.8881,98.3975,1586.7534731525334,1582.655537146604,14.283537958433126,Maria,Mandalay,Burma,Asia,21.9831,96.0844,William,William,Mandalay,Burma,Asia,21.9831,96.0844,Maria,Phuket,Thailand,Asia,7.8881,98.3975,Ian,Delicias,Mexico,North America,28.1931,-105.4717
Marco lives in Batroûn. Leon lives in Čitluk. Scott lives in Pryluky. The person who lives closest to Marco is,Pryluky,Ukraine,Europe,50.5892,32.3856,1836.0215404374296,1829.6747230830026,16.66210562924146,Scott,Batroûn,Lebanon,Asia,34.25,35.65,Marco,Marco,Batroûn,Lebanon,Asia,34.25,35.65,Leon,Čitluk,Bosnia and Herzegovina,Europe,43.2286,17.7008,Scott,Pryluky,Ukraine,Europe,50.5892,32.3856
Frank lives in Kakamega. Joy lives in Novoanninskiy. Max lives in Łobez. The person who lives closest to Frank is,Novoanninskiy,Russia,Asia,50.5333,42.6833,5637.789792374244,5455.631837316694,50.87238689986936,Joy,Kakamega,Kenya,Africa,0.2833,34.75,Frank,Frank,Kakamega,Kenya,Africa,0.2833,34.75,Joy,Novoanninskiy,Russia,Asia,50.5333,42.6833,Max,Łobez,Poland,Europe,53.6333,15.6167
Kyle lives in Rosário. Tyler lives in Limeira. Michael lives in Biga. The person who lives closest to Kyle is,Limeira,Brazil,South America,-22.5647,-47.4017,2209.395371853062,2198.3408242127807,19.884574361298256,Tyler,Rosário,Brazil,South America,-2.9339,-44.235,Kyle,Kyle,Rosário,Brazil,South America,-2.9339,-44.235,Tyler,Limeira,Brazil,South America,-22.5647,-47.4017,Michael,Biga,Turkey,Europe,40.2281,27.2422
Andrew lives in Katiola. Richard lives in Roque Pérez. Henry lives in Rionegro. The person who lives closest to Andrew is,Roque Pérez,Argentina,South America,-35.4167,-59.3167,7456.901807256283,7038.4852678044335,69.54173609344247,Richard,Katiola,Côte d’Ivoire,Africa,8.1333,-5.1,Andrew,Andrew,Katiola,Côte d’Ivoire,Africa,8.1333,-5.1,Richard,Roque Pérez,Argentina,South America,-35.4167,-59.3167,Henry,Rionegro,Colombia,South America,6.1535,-75.3743
Frank lives in Cupira. Jason lives in Mahilyow. Leon lives in Daet. The person who lives closest to Frank is,Mahilyow,Belarus,Europe,53.9167,30.35,9286.240260368539,8485.756274795187,91.13803338321495,Jason,Cupira,Brazil,South America,-8.6169,-35.95,Frank,Frank,Cupira,Brazil,South America,-8.6169,-35.95,Jason,Mahilyow,Belarus,Europe,53.9167,30.35,Leon,Daet,Philippines,Asia,14.1142,122.9564
Brandon lives in Araraquara. Maria lives in Tel Aviv-Yafo. Hope lives in Barão do Grajaú. The person who lives closest to Brandon is,Barão do Grajaú,Brazil,South America,-6.7558,-43.0239,1761.3098560839846,1755.7062715507254,15.896116671061522,Hope,Araraquara,Brazil,South America,-21.7939,-48.1758,Brandon,Brandon,Araraquara,Brazil,South America,-21.7939,-48.1758,Maria,Tel Aviv-Yafo,Israel,Asia,32.08,34.78,Hope,Barão do Grajaú,Brazil,South America,-6.7558,-43.0239
Hunter lives in Fria. Mark lives in Pedras de Fogo. Martin lives in Puerto Tejada. The person who lives closest to Hunter is,Pedras de Fogo,Brazil,South America,-7.4019,-35.1158,3099.971909109594,3069.4816256302656,27.95163542496217,Mark,Fria,Guinea,Africa,10.3804,-13.55,Hunter,Hunter,Fria,Guinea,Africa,10.3804,-13.55,Mark,Pedras de Fogo,Brazil,South America,-7.4019,-35.1158,Martin,Puerto Tejada,Colombia,South America,3.25,-76.4167
Ian lives in Pôrto Esperidião. Matt lives in Sertã. Scott lives in Līkak. The person who lives closest to Ian is,Sertã,Portugal,Europe,39.8008,-8.1003,8088.828777618511,7556.382908472066,75.05612951018725,Matt,Pôrto Esperidião,Brazil,South America,-15.8528,-58.46,Ian,Ian,Pôrto Esperidião,Brazil,South America,-15.8528,-58.46,Matt,Sertã,Portugal,Europe,39.8008,-8.1003,Scott,Līkak,Iran,Asia,30.8928,50.0928
Mark lives in Luhansk. Robert lives in Lohja. Bob lives in Vágur. The person who lives closest to Mark is,Lohja,Finland,Europe,60.25,24.0667,1622.572583105721,1618.1909720465915,19.19952295761538,Robert,Luhansk,Ukraine,Europe,48.5678,39.3031,Mark,Mark,Luhansk,Ukraine,Europe,48.5678,39.3031,Robert,Lohja,Finland,Europe,60.25,24.0667,Bob,Vágur,Faroe Islands,Europe,61.4733,-6.8175
Emily lives in Massaranduba. Richard lives in Wuhu. Walker lives in Ibitiara. The person who lives closest to Emily is,Ibitiara,Brazil,South America,-12.6519,-42.2178,928.9375803010663,928.1149253172283,8.429351625125149,Walker,Massaranduba,Brazil,South America,-7.2,-35.7889,Emily,Emily,Massaranduba,Brazil,South America,-7.2,-35.7889,Richard,Wuhu,China,Asia,31.3526,118.4331,Walker,Ibitiara,Brazil,South America,-12.6519,-42.2178
Leon lives in Plav. Blake lives in Złotoryja. John lives in San José. The person who lives closest to Leon is,Złotoryja,Poland,Europe,51.1333,15.9167,996.5457841824208,995.5301612635177,9.434201173390354,Blake,Plav,Montenegro,Europe,42.6,19.94,Leon,Leon,Plav,Montenegro,Europe,42.6,19.94,Blake,Złotoryja,Poland,Europe,51.1333,15.9167,John,San José,Colombia,South America,1.4744,-77.0836
John lives in Aribinda. Jack lives in Eisenberg. Matt lives in Samaná. The person who lives closest to John is,Eisenberg,Germany,Europe,50.9681,11.9014,4243.2514817586725,4165.257438722413,38.89324284885487,Jack,Aribinda,Burkina Faso,Africa,14.2292,-0.8633,John,John,Aribinda,Burkina Faso,Africa,14.2292,-0.8633,Jack,Eisenberg,Germany,Europe,50.9681,11.9014,Matt,Samaná,Colombia,South America,5.5833,-74.9167
Max lives in Görlitz. Frank lives in Joaquim Gomes. Walker lives in Banja Luka. The person who lives closest to Max is,Banja Luka,Bosnia and Herzegovina,Europe,44.7725,17.1925,728.1200426871385,727.7238453072691,6.750672276151463,Walker,Görlitz,Germany,Europe,51.1528,14.9872,Max,Max,Görlitz,Germany,Europe,51.1528,14.9872,Frank,Joaquim Gomes,Brazil,South America,-9.1328,-35.7478,Walker,Banja Luka,Bosnia and Herzegovina,Europe,44.7725,17.1925
George lives in Aalborg. Bob lives in Canindé. Aaron lives in San Francisco del Rincón. The person who lives closest to George is,Canindé,Brazil,South America,-4.3589,-39.3119,8129.317751183881,7588.945643728541,78.69241734125342,Bob,Aalborg,Denmark,Europe,57.0337,9.9166,George,George,Aalborg,Denmark,Europe,57.0337,9.9166,Bob,Canindé,Brazil,South America,-4.3589,-39.3119,Aaron,San Francisco del Rincón,Mexico,North America,21.0228,-101.86
Scott lives in Jepara. Peter lives in Kirovsk. Andrew lives in Quilmes. The person who lives closest to Scott is,Kirovsk,Russia,Asia,59.8667,30.9833,10065.417983254445,9050.78503904281,103.72272767122934,Peter,Jepara,Indonesia,Asia,-6.5333,110.6667,Scott,Scott,Jepara,Indonesia,Asia,-6.5333,110.6667,Peter,Kirovsk,Russia,Asia,59.8667,30.9833,Andrew,Quilmes,Argentina,South America,-34.7167,-58.2667
Max lives in Potosí. Peter lives in Zoeterwoude. Jerry lives in Miranda. The person who lives closest to Max is,Miranda,Brazil,South America,-20.2408,-56.3778,982.7051239540168,981.7312246633286,9.398115918097622,Jerry,Potosí,Bolivia,South America,-19.5892,-65.7533,Max,Max,Potosí,Bolivia,South America,-19.5892,-65.7533,Peter,Zoeterwoude,Netherlands,Europe,52.1333,4.5,Jerry,Miranda,Brazil,South America,-20.2408,-56.3778
Alex lives in Brokopondo. Luke lives in Boundiali. Hunter lives in Acarape. The person who lives closest to Alex is,Acarape,Brazil,South America,-4.2242,-38.7083,2080.449921680113,2071.2185456437114,18.725821567290446,Hunter,Brokopondo,Suriname,South America,5.0667,-54.9667,Alex,Alex,Brokopondo,Suriname,South America,5.0667,-54.9667,Luke,Boundiali,Côte d’Ivoire,Africa,9.5167,-6.4833,Hunter,Acarape,Brazil,South America,-4.2242,-38.7083
Andrew lives in Yang Talat. Richard lives in Orlândia. Alice lives in Araçatuba. The person who lives closest to Andrew is,Orlândia,Brazil,South America,-20.7203,-47.8867,16951.33315102856,12375.4386083425,155.7428187566284,Richard,Yang Talat,Thailand,Asia,16.3998,103.3678,Andrew,Andrew,Yang Talat,Thailand,Asia,16.3998,103.3678,Richard,Orlândia,Brazil,South America,-20.7203,-47.8867,Alice,Araçatuba,Brazil,South America,-21.2089,-50.4328
Jason lives in Līkak. Leon lives in Kalach-na-Donu. Kyle lives in Gevgelija. The person who lives closest to Jason is,Kalach-na-Donu,Russia,Asia,48.7,43.5167,2056.28328119466,2047.3696051162676,18.982662169727405,Leon,Līkak,Iran,Asia,30.8928,50.0928,Jason,Jason,Līkak,Iran,Asia,30.8928,50.0928,Leon,Kalach-na-Donu,Russia,Asia,48.7,43.5167,Kyle,Gevgelija,North Macedonia,Europe,41.1392,22.5025
Jerry lives in Falan. Matt lives in Ko Samui. Neil lives in Moroto. The person who lives closest to Jerry is,Moroto,Uganda,Africa,2.53,34.67,12151.200492091588,10391.404090919405,109.65090775223888,Neil,Falan,Colombia,South America,5.1333,-74.95,Jerry,Jerry,Falan,Colombia,South America,5.1333,-74.95,Matt,Ko Samui,Thailand,Asia,9.5,100.0,Neil,Moroto,Uganda,Africa,2.53,34.67
Rose lives in Chilapa de Álvarez. Bob lives in Karabük. Dean lives in Mesetas. The person who lives closest to Rose is,Mesetas,Colombia,South America,3.3781,-74.0447,3162.8043711190403,3130.426183092779,28.87517794404045,Dean,Chilapa de Álvarez,Mexico,North America,17.5944,-99.1778,Rose,Rose,Chilapa de Álvarez,Mexico,North America,17.5944,-99.1778,Bob,Karabük,Turkey,Europe,41.1986,32.6264,Dean,Mesetas,Colombia,South America,3.3781,-74.0447
George lives in Heidelberg. Rachel lives in Saboyá. Laura lives in Golyshmanovo. The person who lives closest to George is,Golyshmanovo,Russia,Asia,56.3819,68.3715,3944.2404796416595,3881.5527146439595,60.060046404244474,Laura,Heidelberg,Germany,Europe,49.4167,8.7167,George,George,Heidelberg,Germany,Europe,49.4167,8.7167,Rachel,Saboyá,Colombia,South America,5.7,-73.7667,Laura,Golyshmanovo,Russia,Asia,56.3819,68.3715
Laura lives in Paraguaçu. Grant lives in Jocotitlán. Charlie lives in Santa Isabel do Ivaí. The person who lives closest to Laura is,Santa Isabel do Ivaí,Brazil,South America,-23.0053,-53.1878,780.9141922702602,780.4254252057508,7.566012873369968,Charlie,Paraguaçu,Brazil,South America,-21.5331,-45.7664,Laura,Laura,Paraguaçu,Brazil,South America,-21.5331,-45.7664,Grant,Jocotitlán,Mexico,North America,19.7072,-99.7867,Charlie,Santa Isabel do Ivaí,Brazil,South America,-23.0053,-53.1878
Ian lives in Nowy Targ. Max lives in Ad Darbāsīyah. Andrew lives in Ouro Preto d’Oeste. The person who lives closest to Ian is,Ad Darbāsīyah,Syria,Asia,37.0728,40.652,2153.244655459723,2143.0109348783003,24.07123518434399,Max,Nowy Targ,Poland,Europe,49.4667,20.0167,Ian,Ian,Nowy Targ,Poland,Europe,49.4667,20.0167,Max,Ad Darbāsīyah,Syria,Asia,37.0728,40.652,Andrew,Ouro Preto d’Oeste,Brazil,South America,-10.7481,-62.2158
Kyle lives in Siyang. Richard lives in Shūshtar. Martin lives in Salerno. The person who lives closest to Kyle is,Shūshtar,Iran,Asia,32.045,48.8594,5740.303476947538,5548.096127792464,60.08163236106356,Richard,Siyang,China,Asia,27.2116,108.7463,Kyle,Kyle,Siyang,China,Asia,27.2116,108.7463,Richard,Shūshtar,Iran,Asia,32.045,48.8594,Martin,Salerno,Italy,Europe,40.6806,14.7594
Joy lives in Fundão. Michael lives in Kampong Thom. Charlie lives in Erie. The person who lives closest to Joy is,Erie,United States,North America,42.1167,-80.0733,5890.890385027546,5683.2681397756105,72.60039771550842,Charlie,Fundão,Portugal,Europe,40.1333,-7.5,Joy,Joy,Fundão,Portugal,Europe,40.1333,-7.5,Michael,Kampong Thom,Cambodia,Asia,12.7,104.9,Charlie,Erie,United States,North America,42.1167,-80.0733
Rose lives in San Lucas Sacatepéquez. Tyler lives in Cocorná. Marco lives in Kristiansund. The person who lives closest to Rose is,Cocorná,Colombia,South America,6.0569,-75.1853,1939.4102344576233,1931.930614615398,17.67560811202829,Tyler,San Lucas Sacatepéquez,Guatemala,North America,14.6167,-90.65,Rose,Rose,San Lucas Sacatepéquez,Guatemala,North America,14.6167,-90.65,Tyler,Cocorná,Colombia,South America,6.0569,-75.1853,Marco,Kristiansund,Norway,Europe,63.1105,7.7279
Brandon lives in San José de Bocay. Luke lives in Edinburg. Andrew lives in Kartal. The person who lives closest to Brandon is,Edinburg,United States,North America,26.3196,-98.1597,1937.1973182624424,1929.7432528305785,17.96984820887478,Luke,San José de Bocay,Nicaragua,North America,13.5333,-85.5333,Brandon,Brandon,San José de Bocay,Nicaragua,North America,13.5333,-85.5333,Luke,Edinburg,United States,North America,26.3196,-98.1597,Andrew,Kartal,Turkey,Europe,40.8872,29.19
Maria lives in Joaquim Gomes. John lives in Merced. Connor lives in Piripiri. The person who lives closest to Maria is,Piripiri,Brazil,South America,-4.2728,-41.7769,857.3668842806966,856.7200763310839,7.744007154567975,Connor,Joaquim Gomes,Brazil,South America,-9.1328,-35.7478,Maria,Maria,Joaquim Gomes,Brazil,South America,-9.1328,-35.7478,John,Merced,United States,North America,37.3057,-120.4779,Connor,Piripiri,Brazil,South America,-4.2728,-41.7769
Brandon lives in Kraśnik. Rachel lives in Calabar. William lives in Ouargla. The person who lives closest to Brandon is,Ouargla,Algeria,Africa,31.95,5.3167,2523.01390206047,2506.55953925583,25.403655423777106,William,Kraśnik,Poland,Europe,50.9167,22.2167,Brandon,Brandon,Kraśnik,Poland,Europe,50.9167,22.2167,Rachel,Calabar,Nigeria,Africa,4.9767,8.3383,William,Ouargla,Algeria,Africa,31.95,5.3167
Emily lives in Saint-Germain-en-Laye. Rachel lives in San Antonio de Los Altos. Kyle lives in Tallaght. The person who lives closest to Emily is,Tallaght,Ireland,Europe,53.2878,-6.3411,764.0883100600809,763.6304569915563,9.508416336067746,Kyle,Saint-Germain-en-Laye,France,Europe,48.8989,2.0938,Emily,Emily,Saint-Germain-en-Laye,France,Europe,48.8989,2.0938,Rachel,San Antonio de Los Altos,Venezuela,South America,10.3744,-66.9669,Kyle,Tallaght,Ireland,Europe,53.2878,-6.3411
Rachel lives in Unión de San Antonio. Ian lives in Ilorin. Walker lives in Caucaia. The person who lives closest to Rachel is,Caucaia,Brazil,South America,-3.7328,-38.6558,7427.210353064376,7013.715701451352,68.05370832423462,Walker,Unión de San Antonio,Mexico,North America,21.128,-102.006,Rachel,Rachel,Unión de San Antonio,Mexico,North America,21.128,-102.006,Ian,Ilorin,Nigeria,Africa,8.5,4.55,Walker,Caucaia,Brazil,South America,-3.7328,-38.6558
Connor lives in Jefferson City. Josh lives in Na Klang. Alex lives in Byerazino. The person who lives closest to Connor is,Byerazino,Belarus,Europe,53.8333,28.9833,8301.719612504212,7726.735859029236,122.11712959748931,Alex,Jefferson City,United States,North America,38.5676,-92.1759,Connor,Connor,Jefferson City,United States,North America,38.5676,-92.1759,Josh,Na Klang,Thailand,Asia,17.3072,102.1889,Alex,Byerazino,Belarus,Europe,53.8333,28.9833
Henry lives in Benemérito. Grant lives in Castelli. Dallas lives in Cambridge. The person who lives closest to Henry is,Cambridge,Canada,North America,43.3972,-80.3114,3144.6502547382447,3112.8252909243865,28.800783997835886,Dallas,Benemérito,Mexico,North America,16.5172,-90.6531,Henry,Henry,Benemérito,Mexico,North America,16.5172,-90.6531,Grant,Castelli,Argentina,South America,-25.95,-60.6167,Dallas,Cambridge,Canada,North America,43.3972,-80.3114
Jason lives in Copacabana. Kyle lives in Vareš. Frank lives in González. The person who lives closest to Jason is,González,Colombia,South America,8.4,-73.3333,331.5049588616384,331.46756253557396,2.9943008833448963,Frank,Copacabana,Colombia,South America,6.3333,-75.5,Jason,Jason,Copacabana,Colombia,South America,6.3333,-75.5,Kyle,Vareš,Bosnia and Herzegovina,Europe,44.1644,18.3283,Frank,González,Colombia,South America,8.4,-73.3333
Jack lives in Gemerek. Aaron lives in Oumé. Brandon lives in Cardoso Moreira. The person who lives closest to Jack is,Oumé,Côte d’Ivoire,Africa,6.3833,-5.4167,5521.905822653731,5350.68304680828,52.88418282435685,Aaron,Gemerek,Turkey,Europe,39.1819,36.0681,Jack,Jack,Gemerek,Turkey,Europe,39.1819,36.0681,Aaron,Oumé,Côte d’Ivoire,Africa,6.3833,-5.4167,Brandon,Cardoso Moreira,Brazil,South America,-21.4878,-41.6158
Grant lives in Hatvan. Scott lives in Concórdia. Richard lives in Csorna. The person who lives closest to Grant is,Csorna,Hungary,Europe,47.6167,17.25,181.36230992094414,181.35618627229607,2.420245865609524,Richard,Hatvan,Hungary,Europe,47.6681,19.6697,Grant,Grant,Hatvan,Hungary,Europe,47.6681,19.6697,Scott,Concórdia,Brazil,South America,-27.2339,-52.0278,Richard,Csorna,Hungary,Europe,47.6167,17.25
Alex lives in Jataìzinho. Mark lives in Raalte. Bob lives in Lashkar Gāh. The person who lives closest to Alex is,Raalte,Netherlands,Europe,52.3828,6.2828,10067.792311823285,9052.45614280523,94.86800646545704,Mark,Jataìzinho,Brazil,South America,-23.2539,-50.98,Alex,Alex,Jataìzinho,Brazil,South America,-23.2539,-50.98,Mark,Raalte,Netherlands,Europe,52.3828,6.2828,Bob,Lashkar Gāh,Afghanistan,Asia,31.5831,64.3692
Steve lives in Pocheon. Hope lives in Lechang. Peter lives in Samborondón. The person who lives closest to Steve is,Lechang,China,Asia,35.6415,111.4633,1422.1692653317011,1419.2183489619583,15.89738757941064,Hope,Pocheon,"Korea, South",Asia,37.8947,127.2002,Steve,Steve,Pocheon,"Korea, South",Asia,37.8947,127.2002,Hope,Lechang,China,Asia,35.6415,111.4633,Peter,Samborondón,Ecuador,South America,-2.1833,-79.8833
Matt lives in Anda. Kyle lives in Yitong. Emily lives in Druten. The person who lives closest to Matt is,Yitong,China,Asia,43.3456,125.3039,342.3234179712127,342.28223973842745,3.078775758316934,Kyle,Anda,China,Asia,46.424,125.352,Matt,Matt,Anda,China,Asia,46.424,125.352,Kyle,Yitong,China,Asia,43.3456,125.3039,Emily,Druten,Netherlands,Europe,51.8889,5.6044
Martin lives in Mauá. Hope lives in Lynn. Jason lives in Topeka. The person who lives closest to Martin is,Lynn,United States,North America,42.4781,-70.9664,7773.198430315608,7299.951278340593,70.53938274588174,Hope,Mauá,Brazil,South America,-23.6678,-46.4608,Martin,Martin,Mauá,Brazil,South America,-23.6678,-46.4608,Hope,Lynn,United States,North America,42.4781,-70.9664,Jason,Topeka,United States,North America,39.0346,-95.6955
Michael lives in Brno. Jerry lives in Bạc Liêu. Martin lives in Balatonfüred. The person who lives closest to Michael is,Balatonfüred,Hungary,Europe,46.95,17.8833,266.7332589950483,266.71377869928125,2.579618431086271,Martin,Brno,Czechia,Europe,49.1925,16.6083,Michael,Michael,Brno,Czechia,Europe,49.1925,16.6083,Jerry,Bạc Liêu,Vietnam,Asia,9.2833,105.7167,Martin,Balatonfüred,Hungary,Europe,46.95,17.8833
Maria lives in Xiashi. Mark lives in Porto de Pedras. Grant lives in Kandangan. The person who lives closest to Maria is,Kandangan,Indonesia,Asia,-2.7833,115.2667,3748.962080534355,3695.1069921386415,33.75404258929588,Grant,Xiashi,China,Asia,30.5333,120.6833,Maria,Maria,Xiashi,China,Asia,30.5333,120.6833,Mark,Porto de Pedras,Brazil,South America,-9.1578,-35.295,Grant,Kandangan,Indonesia,Asia,-2.7833,115.2667
Mark lives in São Mateus do Sul. Jack lives in Sayula de Alemán. Rose lives in Bronx. The person who lives closest to Mark is,Sayula de Alemán,Mexico,North America,17.8833,-94.95,6846.64152796473,6521.902372475299,62.4574084291047,Jack,São Mateus do Sul,Brazil,South America,-25.8739,-50.3828,Mark,Mark,São Mateus do Sul,Brazil,South America,-25.8739,-50.3828,Jack,Sayula de Alemán,Mexico,North America,17.8833,-94.95,Rose,Bronx,United States,North America,40.8501,-73.8662
Jason lives in Wanyuan. Walker lives in Caucaia. Luke lives in Caraíbas. The person who lives closest to Jason is,Caucaia,Brazil,South America,-3.7328,-38.6558,15327.211991489841,11889.331563865835,150.90989797047774,Walker,Wanyuan,China,Asia,31.9833,107.9667,Jason,Jason,Wanyuan,China,Asia,31.9833,107.9667,Walker,Caucaia,Brazil,South America,-3.7328,-38.6558,Luke,Caraíbas,Brazil,South America,-14.6,-41.335
Robert lives in Guamal. Max lives in Chieti. Marco lives in Alagoa Grande. The person who lives closest to Robert is,Alagoa Grande,Brazil,South America,-7.0822,-35.6,4645.090936944502,4542.886453899308,41.90071985491419,Marco,Guamal,Colombia,South America,9.1472,-74.23,Robert,Robert,Guamal,Colombia,South America,9.1472,-74.23,Max,Chieti,Italy,Europe,42.3511,14.1674,Marco,Alagoa Grande,Brazil,South America,-7.0822,-35.6
Aaron lives in Beydağ. Brandon lives in Karuzi. Blake lives in Itariri. The person who lives closest to Aaron is,Karuzi,Burundi,Africa,-3.1,30.1667,4583.70147277051,4485.478730109644,41.22865792685957,Brandon,Beydağ,Turkey,Europe,38.0833,28.2333,Aaron,Aaron,Beydağ,Turkey,Europe,38.0833,28.2333,Brandon,Karuzi,Burundi,Africa,-3.1,30.1667,Blake,Itariri,Brazil,South America,-24.2888,-47.1332
Steve lives in Japeri. Joy lives in Potengi. Scott lives in Ochër. The person who lives closest to Steve is,Potengi,Brazil,South America,-7.0908,-40.0269,1772.3900673666483,1766.6801303539269,15.969496305456852,Joy,Japeri,Brazil,South America,-22.6431,-43.6533,Steve,Steve,Japeri,Brazil,South America,-22.6431,-43.6533,Joy,Potengi,Brazil,South America,-7.0908,-40.0269,Scott,Ochër,Russia,Asia,57.8833,54.7333
Grant lives in Heppenheim. Brandon lives in Merzifon. April lives in Gemerek. The person who lives closest to Grant is,Merzifon,Turkey,Europe,40.875,35.4633,2298.4609889553744,2286.0164628025736,28.221056198696743,Brandon,Heppenheim,Germany,Europe,49.6431,8.6389,Grant,Grant,Heppenheim,Germany,Europe,49.6431,8.6389,Brandon,Merzifon,Turkey,Europe,40.875,35.4633,April,Gemerek,Turkey,Europe,39.1819,36.0681
Aaron lives in Ciudad del Este. Alex lives in Nivala. Brandon lives in Działdowo. The person who lives closest to Aaron is,Działdowo,Poland,Europe,53.2333,20.1833,11312.841856121875,9884.09225754828,108.61175231235339,Brandon,Ciudad del Este,Paraguay,South America,-25.5167,-54.6161,Aaron,Aaron,Ciudad del Este,Paraguay,South America,-25.5167,-54.6161,Alex,Nivala,Finland,Europe,63.925,24.975,Brandon,Działdowo,Poland,Europe,53.2333,20.1833
Max lives in San Juan. William lives in Koryazhma. Dallas lives in Kumru. The person who lives closest to Max is,Kumru,Turkey,Europe,40.8744,37.2639,13473.866890840249,11099.553881580796,128.1972287296414,Dallas,San Juan,Argentina,South America,-31.5342,-68.5261,Max,Max,San Juan,Argentina,South America,-31.5342,-68.5261,William,Koryazhma,Russia,Asia,61.3167,47.1333,Dallas,Kumru,Turkey,Europe,40.8744,37.2639
Jason lives in Araban. Luke lives in Bamenda. Aaron lives in Libourne. The person who lives closest to Jason is,Libourne,France,Europe,44.92,-0.24,3250.4106674620093,3215.272824381589,38.66622347644,Aaron,Araban,Turkey,Europe,37.4247,37.6928,Jason,Jason,Araban,Turkey,Europe,37.4247,37.6928,Luke,Bamenda,Cameroon,Africa,5.9614,10.1517,Aaron,Libourne,France,Europe,44.92,-0.24
Leon lives in Skopin. Mark lives in Bad Fallingbostel. Michael lives in Shekhupura. The person who lives closest to Leon is,Bad Fallingbostel,Germany,Europe,52.8675,9.6967,1970.0304847781924,1962.1912566265119,29.86838632283304,Mark,Skopin,Russia,Asia,53.8167,39.55,Leon,Leon,Skopin,Russia,Asia,53.8167,39.55,Mark,Bad Fallingbostel,Germany,Europe,52.8675,9.6967,Michael,Shekhupura,Pakistan,Asia,31.7111,73.9878
