context,correct_city,correct_country,correct_continent,correct_lat,correct_lon,correct_geodesic_dist,correct_through_earth_dist,correct_euclidean_dist,correct_answer,reference_city,reference_country,reference_continent,reference_lat,reference_lon,reference_name,name_1,city_1,country_1,continent_1,lat_1,lon_1,name_2,city_2,country_2,continent_2,lat_2,lon_2,name_3,city_3,country_3,continent_3,lat_3,lon_3
Blake lives in Catuípe. Max lives in Jinchang. Jason lives in Borås. The person who lives closest to Blake is,Borås,Sweden,Europe,57.7304,12.92,11394.178382074917,9935.221201698874,108.96104084382638,Jason,Catuípe,Brazil,South America,-28.25,-54.0119,Blake,Blake,Catuípe,Brazil,South America,-28.25,-54.0119,Max,Jinchang,China,Asia,38.5214,102.188,Jason,Borås,Sweden,Europe,57.7304,12.92
Henry lives in São Gabriel. Emily lives in San Pablo. Peter lives in Umarkot. The person who lives closest to Henry is,San Pablo,Colombia,South America,1.6725,-77.0139,4295.605899490927,4214.700295730336,39.2370279977982,Emily,São Gabriel,Brazil,South America,-30.3358,-54.32,Henry,Henry,São Gabriel,Brazil,South America,-30.3358,-54.32,Emily,San Pablo,Colombia,South America,1.6725,-77.0139,Peter,Umarkot,Pakistan,Asia,25.3631,69.7425
Alex lives in Tadmur. Aaron lives in Massaranduba. Scott lives in Rio Acima. The person who lives closest to Alex is,Rio Acima,Brazil,South America,-20.0878,-43.7889,10569.545712858213,9398.459017015228,98.59603902835043,Scott,Tadmur,Syria,Asia,34.5504,38.2833,Alex,Alex,Tadmur,Syria,Asia,34.5504,38.2833,Aaron,Massaranduba,Brazil,South America,-26.6108,-49.0078,Scott,Rio Acima,Brazil,South America,-20.0878,-43.7889
Jerry lives in Prata. Josh lives in La Montañita. Alex lives in Yushu. The person who lives closest to Jerry is,La Montañita,Colombia,South America,1.5833,-75.25,3695.6735350920376,3644.076176531851,33.60749912221973,Josh,Prata,Brazil,South America,-19.3069,-48.9239,Jerry,Jerry,Prata,Brazil,South America,-19.3069,-48.9239,Josh,La Montañita,Colombia,South America,1.5833,-75.25,Alex,Yushu,China,Asia,44.826,126.55
Richard lives in Rincão. Bob lives in Piatykhatky. Ian lives in Zwettl. The person who lives closest to Richard is,Zwettl,Austria,Europe,48.6033,15.1689,10002.001595044863,9006.035107388789,94.47710745005904,Ian,Rincão,Brazil,South America,-21.5869,-48.0708,Richard,Richard,Rincão,Brazil,South America,-21.5869,-48.0708,Bob,Piatykhatky,Ukraine,Europe,48.4136,33.7028,Ian,Zwettl,Austria,Europe,48.6033,15.1689
Hunter lives in Drochia. Blake lives in Zhangatas. Bob lives in Waitangi. The person who lives closest to Hunter is,Zhangatas,Kazakhstan,Asia,43.5705,69.7335,3250.865464691216,3215.7129021071264,42.22002908679719,Blake,Drochia,Moldova,Europe,48.0333,27.75,Hunter,Hunter,Drochia,Moldova,Europe,48.0333,27.75,Blake,Zhangatas,Kazakhstan,Asia,43.5705,69.7335,Bob,Waitangi,New Zealand,Oceania,-43.9514,-176.5611
Steve lives in San Ġwann. Leon lives in Annaberg-Buchholz. Luke lives in Pingtung. The person who lives closest to Steve is,Annaberg-Buchholz,Germany,Europe,50.58,13.0022,1635.5859088576435,1631.0980846799227,14.744702822369803,Leon,San Ġwann,Malta,Europe,35.9094,14.4786,Steve,Steve,San Ġwann,Malta,Europe,35.9094,14.4786,Leon,Annaberg-Buchholz,Germany,Europe,50.58,13.0022,Luke,Pingtung,Taiwan,Asia,22.6761,120.4942
Max lives in Igaraçu do Tietê. Charlie lives in Petroúpoli. Connor lives in Etten-Leur. The person who lives closest to Max is,Etten-Leur,Netherlands,Europe,51.5706,4.6356,9726.421037191598,8808.994447147488,91.19953164134124,Connor,Igaraçu do Tietê,Brazil,South America,-22.5092,-48.5578,Max,Max,Igaraçu do Tietê,Brazil,South America,-22.5092,-48.5578,Charlie,Petroúpoli,Greece,Europe,38.0333,23.6833,Connor,Etten-Leur,Netherlands,Europe,51.5706,4.6356
Martin lives in Ayapel. Aaron lives in Uryupinsk. Jack lives in Kungälv. The person who lives closest to Martin is,Kungälv,Sweden,Europe,57.8667,11.9667,9054.969867816451,8311.84476007136,100.22236236933352,Jack,Ayapel,Colombia,South America,8.3167,-75.15,Martin,Martin,Ayapel,Colombia,South America,8.3167,-75.15,Aaron,Uryupinsk,Russia,Asia,50.8,42.0167,Jack,Kungälv,Sweden,Europe,57.8667,11.9667
Steve lives in Milicz. Connor lives in Diekirch. Andrew lives in San Julián. The person who lives closest to Steve is,Diekirch,Luxembourg,Europe,49.8681,6.1567,804.3340041069524,803.7999364121359,11.250516370371628,Connor,Milicz,Poland,Europe,51.5333,17.2833,Steve,Steve,Milicz,Poland,Europe,51.5333,17.2833,Connor,Diekirch,Luxembourg,Europe,49.8681,6.1567,Andrew,San Julián,Mexico,North America,21.0167,-102.1667
Aaron lives in Ixtaczoquitlán. Bob lives in Une. Michael lives in Torghay. The person who lives closest to Aaron is,Une,Colombia,South America,4.4019,-74.025,2972.8102826267036,2945.913950069783,27.196829456758365,Bob,Ixtaczoquitlán,Mexico,North America,18.85,-97.0667,Aaron,Aaron,Ixtaczoquitlán,Mexico,North America,18.85,-97.0667,Bob,Une,Colombia,South America,4.4019,-74.025,Michael,Torghay,Kazakhstan,Asia,49.626,63.499
William lives in Sariwŏn. Kyle lives in São Miguel Arcanjo. Jack lives in Labuan. The person who lives closest to William is,Labuan,Malaysia,Asia,5.2803,115.2475,3843.976183556555,3785.934613021594,34.84939124360711,Jack,Sariwŏn,"Korea, North",Asia,38.5064,125.7597,William,William,Sariwŏn,"Korea, North",Asia,38.5064,125.7597,Kyle,São Miguel Arcanjo,Brazil,South America,-23.8778,-47.9969,Jack,Labuan,Malaysia,Asia,5.2803,115.2475
Connor lives in Pindoretama. Rose lives in Humaitá. Ian lives in Şa‘dah. The person who lives closest to Connor is,Humaitá,Brazil,South America,-7.5061,-63.0208,2760.8469694747346,2739.295293402666,24.95856157493857,Rose,Pindoretama,Brazil,South America,-4.0278,-38.3058,Connor,Connor,Pindoretama,Brazil,South America,-4.0278,-38.3058,Rose,Humaitá,Brazil,South America,-7.5061,-63.0208,Ian,Şa‘dah,Yemen,Asia,16.94,43.7592
Robert lives in Ağstafa. Jerry lives in Petapa. Jack lives in Banská Bystrica. The person who lives closest to Robert is,Banská Bystrica,Slovakia,Europe,48.7353,19.1453,2223.524063288779,2212.256298308862,27.388902550485664,Jack,Ağstafa,Azerbaijan,Europe,41.1189,45.4539,Robert,Robert,Ağstafa,Azerbaijan,Europe,41.1189,45.4539,Jerry,Petapa,Guatemala,North America,14.5,-90.5667,Jack,Banská Bystrica,Slovakia,Europe,48.7353,19.1453
Robert lives in Stadthagen. Dallas lives in Chinácota. Blake lives in Gustavsberg. The person who lives closest to Robert is,Gustavsberg,Sweden,Europe,59.3167,18.3833,964.1135251888226,963.1938515139396,11.536653802554705,Blake,Stadthagen,Germany,Europe,52.3247,9.2069,Robert,Robert,Stadthagen,Germany,Europe,52.3247,9.2069,Dallas,Chinácota,Colombia,South America,7.6167,-72.6,Blake,Gustavsberg,Sweden,Europe,59.3167,18.3833
Fred lives in Partizansk. Josh lives in Tuzluca. Laura lives in Rio Bananal. The person who lives closest to Fred is,Tuzluca,Turkey,Europe,40.0494,43.6608,7068.731739579369,6711.695120396419,89.5084709628089,Josh,Partizansk,Russia,Asia,43.1167,133.1167,Fred,Fred,Partizansk,Russia,Asia,43.1167,133.1167,Josh,Tuzluca,Turkey,Europe,40.0494,43.6608,Laura,Rio Bananal,Brazil,South America,-19.265,-40.3333
Rachel lives in Saboyá. Laura lives in Montes Altos. Max lives in Ahram. The person who lives closest to Rachel is,Montes Altos,Brazil,South America,-5.8333,-47.0667,3229.420189935935,3194.957255198875,29.084480550458522,Laura,Saboyá,Colombia,South America,5.7,-73.7667,Rachel,Rachel,Saboyá,Colombia,South America,5.7,-73.7667,Laura,Montes Altos,Brazil,South America,-5.8333,-47.0667,Max,Ahram,Iran,Asia,28.8828,51.2756
Richard lives in Xigazê. Alice lives in Bandar-e Torkaman. Henry lives in Anda. The person who lives closest to Richard is,Bandar-e Torkaman,Iran,Asia,36.9014,54.0736,3333.070443540868,3295.1894746840526,35.640694943421074,Alice,Xigazê,China,Asia,29.25,88.8833,Richard,Richard,Xigazê,China,Asia,29.25,88.8833,Alice,Bandar-e Torkaman,Iran,Asia,36.9014,54.0736,Henry,Anda,Philippines,Asia,9.744,124.576
Alice lives in Juchique de Ferrer. Hunter lives in Mineiros. Hope lives in Maipú. The person who lives closest to Alice is,Mineiros,Brazil,South America,-17.5689,-52.5508,6365.19088254029,6103.741598034717,57.86256497494732,Hunter,Juchique de Ferrer,Mexico,North America,19.8333,-96.7,Alice,Alice,Juchique de Ferrer,Mexico,North America,19.8333,-96.7,Hunter,Mineiros,Brazil,South America,-17.5689,-52.5508,Hope,Maipú,Argentina,South America,-36.8667,-57.8667
Laura lives in Germī. Aaron lives in Dol. Charlie lives in Malgobek. The person who lives closest to Laura is,Malgobek,Russia,Asia,43.5,44.75,569.5819964784072,569.392326358646,5.574448867825413,Charlie,Germī,Iran,Asia,39.0297,48.0803,Laura,Laura,Germī,Iran,Asia,39.0297,48.0803,Aaron,Dol,Slovenia,Europe,46.0884,14.6425,Charlie,Malgobek,Russia,Asia,43.5,44.75
Michael lives in Nava. Marco lives in Bozdoğan. Matt lives in Sincelejo. The person who lives closest to Michael is,Sincelejo,Colombia,South America,9.295,-75.3961,3398.2544001062297,3358.1126252598897,31.77305643025234,Matt,Nava,Mexico,North America,28.4214,-100.7675,Michael,Michael,Nava,Mexico,North America,28.4214,-100.7675,Marco,Bozdoğan,Turkey,Europe,37.6728,28.3103,Matt,Sincelejo,Colombia,South America,9.295,-75.3961
Brandon lives in Tonalá. Kevin lives in Erciş. Frank lives in Voronezh. The person who lives closest to Brandon is,Voronezh,Russia,Asia,51.6717,39.2106,11186.083133835693,9803.608334350663,145.78984077160518,Frank,Tonalá,Mexico,North America,20.6167,-103.2333,Brandon,Brandon,Tonalá,Mexico,North America,20.6167,-103.2333,Kevin,Erciş,Turkey,Europe,39.0311,43.3597,Frank,Voronezh,Russia,Asia,51.6717,39.2106
Robert lives in Ağstafa. Josh lives in Paxtakor Shahri. Martin lives in Onverwacht. The person who lives closest to Robert is,Paxtakor Shahri,Uzbekistan,Asia,40.3153,67.9544,1893.1533315056704,1886.1958580523608,22.514845618169367,Josh,Ağstafa,Azerbaijan,Europe,41.1189,45.4539,Robert,Robert,Ağstafa,Azerbaijan,Europe,41.1189,45.4539,Josh,Paxtakor Shahri,Uzbekistan,Asia,40.3153,67.9544,Martin,Onverwacht,Suriname,South America,5.5931,-55.1939
Brandon lives in Patnos. Tyler lives in Cocorná. Peter lives in Güney. The person who lives closest to Brandon is,Güney,Turkey,Europe,38.1544,29.0678,1202.5536844134829,1200.7692789192477,13.843103214236324,Peter,Patnos,Turkey,Europe,39.2358,42.8686,Brandon,Brandon,Patnos,Turkey,Europe,39.2358,42.8686,Tyler,Cocorná,Colombia,South America,6.0569,-75.1853,Peter,Güney,Turkey,Europe,38.1544,29.0678
Hunter lives in Lagoa do Carro. Josh lives in Sremski Karlovci. Mark lives in Krosno. The person who lives closest to Hunter is,Sremski Karlovci,Serbia,Europe,45.2,19.9333,8059.698093773965,7532.907717862004,76.5943809028443,Josh,Lagoa do Carro,Brazil,South America,-7.845,-35.32,Hunter,Hunter,Lagoa do Carro,Brazil,South America,-7.845,-35.32,Josh,Sremski Karlovci,Serbia,Europe,45.2,19.9333,Mark,Krosno,Poland,Europe,49.6833,21.75
Josh lives in Mansa Konko. Dean lives in Ljubljana. George lives in Naumburg. The person who lives closest to Josh is,Ljubljana,Slovenia,Europe,46.0514,14.5061,4586.770492644765,4488.351175879025,44.32980736818061,Dean,Mansa Konko,"Gambia, The",Africa,13.4667,-15.55,Josh,Josh,Mansa Konko,"Gambia, The",Africa,13.4667,-15.55,Dean,Ljubljana,Slovenia,Europe,46.0514,14.5061,George,Naumburg,Germany,Europe,51.15,11.8167
Frank lives in Orekhovo-Zuyevo. Marco lives in Bozdoğan. Jack lives in Isnos. The person who lives closest to Frank is,Bozdoğan,Turkey,Europe,37.6728,28.3103,2167.272732362749,2156.8378870538168,21.027463965014892,Marco,Orekhovo-Zuyevo,Russia,Asia,55.8,38.9667,Frank,Frank,Orekhovo-Zuyevo,Russia,Asia,55.8,38.9667,Marco,Bozdoğan,Turkey,Europe,37.6728,28.3103,Jack,Isnos,Colombia,South America,1.9333,-76.2333
Hope lives in Natividade do Carangola. Maria lives in Ba‘qūbah. Dean lives in Fangting. The person who lives closest to Hope is,Ba‘qūbah,Iraq,Asia,33.7447,44.6436,10990.313900803312,9677.403599368035,102.48888861003421,Maria,Natividade do Carangola,Brazil,South America,-21.0419,-41.9728,Hope,Hope,Natividade do Carangola,Brazil,South America,-21.0419,-41.9728,Maria,Ba‘qūbah,Iraq,Asia,33.7447,44.6436,Dean,Fangting,China,Asia,31.127,104.167
Jerry lives in Doğubayazıt. Mark lives in Belém de Maria. Brandon lives in Alvinópolis. The person who lives closest to Jerry is,Belém de Maria,Brazil,South America,-8.6139,-35.8089,9762.592875583421,8835.094303448737,93.28587874941202,Mark,Doğubayazıt,Turkey,Europe,39.5472,44.0833,Jerry,Jerry,Doğubayazıt,Turkey,Europe,39.5472,44.0833,Mark,Belém de Maria,Brazil,South America,-8.6139,-35.8089,Brandon,Alvinópolis,Brazil,South America,-20.1069,-43.0489
Joy lives in Al Jīzah. Luke lives in Dunedin. John lives in Miracema do Tocantins. The person who lives closest to Joy is,Miracema do Tocantins,Brazil,South America,-9.5669,-48.3919,10036.59675013513,9030.474989150789,93.88895087096245,John,Al Jīzah,Jordan,Asia,31.6833,35.95,Joy,Joy,Al Jīzah,Jordan,Asia,31.6833,35.95,Luke,Dunedin,New Zealand,Oceania,-45.8742,170.5036,John,Miracema do Tocantins,Brazil,South America,-9.5669,-48.3919
William lives in Star Dojran. Grant lives in Salamá. Max lives in Alta Floresta. The person who lives closest to William is,Alta Floresta,Brazil,South America,-9.8758,-56.0858,9810.086668850612,8869.255387876612,93.90292795488328,Max,Star Dojran,North Macedonia,Europe,41.1865,22.7203,William,William,Star Dojran,North Macedonia,Europe,41.1865,22.7203,Grant,Salamá,Guatemala,North America,15.1,-90.2667,Max,Alta Floresta,Brazil,South America,-9.8758,-56.0858
Andrew lives in Paispamba. Blake lives in Niamey. Jerry lives in Ermelo. The person who lives closest to Andrew is,Niamey,Niger,Africa,13.515,2.1175,8727.715647233024,8061.0902037710875,79.50293167952991,Blake,Paispamba,Colombia,South America,2.25,-76.5833,Andrew,Andrew,Paispamba,Colombia,South America,2.25,-76.5833,Blake,Niamey,Niger,Africa,13.515,2.1175,Jerry,Ermelo,Netherlands,Europe,52.3,5.6331
Hunter lives in Três Lagoas. Jason lives in Türkistan. Jerry lives in Fort-Shevchenko. The person who lives closest to Hunter is,Fort-Shevchenko,Kazakhstan,Asia,44.5167,50.2667,12539.841958653144,10611.452003042534,121.08902878667415,Jerry,Três Lagoas,Brazil,South America,-20.7876,-51.7034,Hunter,Hunter,Três Lagoas,Brazil,South America,-20.7876,-51.7034,Jason,Türkistan,Kazakhstan,Asia,43.3019,68.2692,Jerry,Fort-Shevchenko,Kazakhstan,Asia,44.5167,50.2667
Alice lives in Copenhagen. Walker lives in General Martín Miguel de Güemes. Connor lives in Castro Daire. The person who lives closest to Alice is,Castro Daire,Portugal,Europe,40.9,-7.9333,2219.354699226796,2208.150136620891,25.268557681236977,Connor,Copenhagen,Denmark,Europe,55.6805,12.5615,Alice,Alice,Copenhagen,Denmark,Europe,55.6805,12.5615,Walker,General Martín Miguel de Güemes,Argentina,South America,-24.6667,-65.05,Connor,Castro Daire,Portugal,Europe,40.9,-7.9333
Maria lives in Ambatondrazaka. Robert lives in Nabatîyé. Frank lives in Natitingou. The person who lives closest to Maria is,Nabatîyé,Lebanon,Asia,33.3833,35.45,5858.964492108142,5654.6760235801385,52.83213464672803,Robert,Ambatondrazaka,Madagascar,Africa,-17.8329,48.4167,Maria,Maria,Ambatondrazaka,Madagascar,Africa,-17.8329,48.4167,Robert,Nabatîyé,Lebanon,Asia,33.3833,35.45,Frank,Natitingou,Benin,Africa,10.3,1.3667
Max lives in Antônio Carlos. Jason lives in Severodvinsk. Rachel lives in Şa‘dah. The person who lives closest to Max is,Şa‘dah,Yemen,Asia,16.94,43.7592,10435.664943542764,9307.540067070668,95.50380514958553,Rachel,Antônio Carlos,Brazil,South America,-21.3178,-43.7469,Max,Max,Antônio Carlos,Brazil,South America,-21.3178,-43.7469,Jason,Severodvinsk,Russia,Asia,64.5667,39.8667,Rachel,Şa‘dah,Yemen,Asia,16.94,43.7592
Blake lives in Nsukka. Max lives in Şuḩār. Ryan lives in Meschede. The person who lives closest to Blake is,Meschede,Germany,Europe,51.35,8.2833,4948.10544440344,4824.677013118958,44.50215052264329,Ryan,Nsukka,Nigeria,Africa,6.8567,7.3958,Blake,Blake,Nsukka,Nigeria,Africa,6.8567,7.3958,Max,Şuḩār,Oman,Asia,24.342,56.7299,Ryan,Meschede,Germany,Europe,51.35,8.2833
Matt lives in Afrânio. Blake lives in Bogoroditsk. Jerry lives in Rosario de Lerma. The person who lives closest to Matt is,Rosario de Lerma,Argentina,South America,-24.9833,-65.5833,3184.6875340871306,3151.634034098073,29.597936039190294,Jerry,Afrânio,Brazil,South America,-8.5,-41.0,Matt,Matt,Afrânio,Brazil,South America,-8.5,-41.0,Blake,Bogoroditsk,Russia,Asia,53.7667,38.1333,Jerry,Rosario de Lerma,Argentina,South America,-24.9833,-65.5833
Richard lives in Gastre. Alice lives in Mansehra. Luke lives in Martinópole. The person who lives closest to Richard is,Martinópole,Brazil,South America,-3.2258,-40.6969,5182.111270416156,5040.433600030175,48.348431875811656,Luke,Gastre,Argentina,South America,-42.2667,-69.2167,Richard,Richard,Gastre,Argentina,South America,-42.2667,-69.2167,Alice,Mansehra,Pakistan,Asia,34.3339,73.2014,Luke,Martinópole,Brazil,South America,-3.2258,-40.6969
Hunter lives in Conchal. Jason lives in Eisenstadt. Laura lives in Porto Novo. The person who lives closest to Hunter is,Porto Novo,Cabo Verde,Africa,17.019,-25.064,4993.359079982731,4866.53066253109,45.13471876992256,Laura,Conchal,Brazil,South America,-22.33,-47.1728,Hunter,Hunter,Conchal,Brazil,South America,-22.33,-47.1728,Jason,Eisenstadt,Austria,Europe,47.85,16.5167,Laura,Porto Novo,Cabo Verde,Africa,17.019,-25.064
Connor lives in Chopinzinho. Luke lives in Beočin. Tyler lives in Ramiriquí. The person who lives closest to Connor is,Ramiriquí,Colombia,South America,5.4,-73.3333,4137.700927449656,4065.3638842665546,37.5499925950725,Tyler,Chopinzinho,Brazil,South America,-25.8558,-52.5228,Connor,Connor,Chopinzinho,Brazil,South America,-25.8558,-52.5228,Luke,Beočin,Serbia,Europe,45.1922,19.7203,Tyler,Ramiriquí,Colombia,South America,5.4,-73.3333
Michael lives in Cañasgordas. Marco lives in Funadhoo. Brandon lives in Rio Claro. The person who lives closest to Michael is,Rio Claro,Brazil,South America,-22.7228,-44.1358,4772.200632517816,4661.415057311157,43.42350004605801,Brandon,Cañasgordas,Colombia,South America,6.7497,-76.0258,Michael,Michael,Cañasgordas,Colombia,South America,6.7497,-76.0258,Marco,Funadhoo,Maldives,Asia,6.1482,73.29,Brandon,Rio Claro,Brazil,South America,-22.7228,-44.1358
Brandon lives in Tururu. Bob lives in Buluan. Dean lives in Pau d’Alho. The person who lives closest to Brandon is,Pau d’Alho,Brazil,South America,-7.8969,-35.18,672.3377130480985,672.0257698591398,6.062170965916419,Dean,Tururu,Brazil,South America,-3.5808,-39.4369,Brandon,Brandon,Tururu,Brazil,South America,-3.5808,-39.4369,Bob,Buluan,Philippines,Asia,6.7154,124.7854,Dean,Pau d’Alho,Brazil,South America,-7.8969,-35.18
Matt lives in Cachoeirinha. Scott lives in Khamir. Blake lives in Cocorná. The person who lives closest to Matt is,Cocorná,Colombia,South America,6.0569,-75.1853,4757.667442649081,4647.886258599218,43.3237811513492,Blake,Cachoeirinha,Brazil,South America,-29.9508,-51.0939,Matt,Matt,Cachoeirinha,Brazil,South America,-29.9508,-51.0939,Scott,Khamir,Yemen,Asia,15.9889,43.9589,Blake,Cocorná,Colombia,South America,6.0569,-75.1853
Richard lives in Ketapang. Emily lives in Kllokot. Ian lives in Vitomarci. The person who lives closest to Richard is,Kllokot,Kosovo,Europe,42.3714,21.3744,10031.946739368386,9027.193839462288,99.03064867590236,Emily,Ketapang,Indonesia,Asia,-1.85,109.9833,Richard,Richard,Ketapang,Indonesia,Asia,-1.85,109.9833,Emily,Kllokot,Kosovo,Europe,42.3714,21.3744,Ian,Vitomarci,Slovenia,Europe,46.5275,15.9394
Richard lives in Bilohirsk. Jerry lives in Bertoua. Blake lives in Santo Domingo de los Colorados. The person who lives closest to Richard is,Bertoua,Cameroon,Africa,4.5833,13.6833,4938.454730493734,4815.743483801213,45.55776895788467,Jerry,Bilohirsk,Ukraine,Europe,45.0544,34.6022,Richard,Richard,Bilohirsk,Ukraine,Europe,45.0544,34.6022,Jerry,Bertoua,Cameroon,Africa,4.5833,13.6833,Blake,Santo Domingo de los Colorados,Ecuador,South America,-0.2542,-79.1719
Henry lives in Doğubayazıt. Jerry lives in Rahovec. Emily lives in Struer. The person who lives closest to Henry is,Rahovec,Kosovo,Europe,42.3994,20.6547,1985.8031921620056,1977.7743164969365,23.60157500676597,Jerry,Doğubayazıt,Turkey,Europe,39.5472,44.0833,Henry,Henry,Doğubayazıt,Turkey,Europe,39.5472,44.0833,Jerry,Rahovec,Kosovo,Europe,42.3994,20.6547,Emily,Struer,Denmark,Europe,56.4862,8.6044
Ian lives in Harlingen. William lives in Donghua. Jason lives in Yorosso. The person who lives closest to Ian is,Yorosso,Mali,Africa,12.3581,-4.7769,4628.019040463557,4526.932373993904,42.0717089866813,Jason,Harlingen,Netherlands,Europe,53.1736,5.4272,Ian,Ian,Harlingen,Netherlands,Europe,53.1736,5.4272,William,Donghua,China,Asia,35.2167,106.6,Jason,Yorosso,Mali,Africa,12.3581,-4.7769
Richard lives in Mamoudzou. Jerry lives in Bagadó. John lives in La Independencia. The person who lives closest to Richard is,Bagadó,Colombia,South America,5.4167,-76.4167,13568.240964366158,11145.59669052561,122.99807359280064,Jerry,Mamoudzou,Mayotte,Africa,-12.7806,45.2278,Richard,Richard,Mamoudzou,Mayotte,Africa,-12.7806,45.2278,Jerry,Bagadó,Colombia,South America,5.4167,-76.4167,John,La Independencia,Mexico,North America,16.2526,-92.0237
Kevin lives in Pasig City. April lives in San Carlos Sija. Walker lives in Kuala Belait. The person who lives closest to Kevin is,Kuala Belait,Brunei,Asia,4.5828,114.1918,1341.3398180835015,1338.863825372087,12.122441642672483,Walker,Pasig City,Philippines,Asia,14.5605,121.0765,Kevin,Kevin,Pasig City,Philippines,Asia,14.5605,121.0765,April,San Carlos Sija,Guatemala,North America,14.9833,-91.55,Walker,Kuala Belait,Brunei,Asia,4.5828,114.1918
Alex lives in Pearland. Michael lives in Baley. Henry lives in Leverkusen. The person who lives closest to Alex is,Leverkusen,Germany,Europe,51.0333,6.9833,8285.79302048896,7714.0656291227915,104.5347679054677,Henry,Pearland,United States,North America,29.5581,-95.3218,Alex,Alex,Pearland,United States,North America,29.5581,-95.3218,Michael,Baley,Russia,Asia,51.6,116.6333,Henry,Leverkusen,Germany,Europe,51.0333,6.9833
Walker lives in Kostroma. George lives in Chełmno. Tyler lives in Lillehammer. The person who lives closest to Walker is,Chełmno,Poland,Europe,53.3492,18.4231,1489.7750392186003,1486.3831724486997,22.933549477784723,George,Kostroma,Russia,Asia,57.7681,40.9269,Walker,Walker,Kostroma,Russia,Asia,57.7681,40.9269,George,Chełmno,Poland,Europe,53.3492,18.4231,Tyler,Lillehammer,Norway,Europe,61.1161,10.4578
Kevin lives in San Antonio. Steve lives in Rathenow. Blake lives in Trindade. The person who lives closest to Kevin is,Trindade,Brazil,South America,-16.6489,-49.4889,3660.2739572177125,3610.1411205712425,33.15902933696944,Blake,San Antonio,Colombia,South America,3.9167,-75.5,Kevin,Kevin,San Antonio,Colombia,South America,3.9167,-75.5,Steve,Rathenow,Germany,Europe,52.6,12.3333,Blake,Trindade,Brazil,South America,-16.6489,-49.4889
Frank lives in Changchun. Alice lives in Khovaling. Dallas lives in Holstebro. The person who lives closest to Frank is,Khovaling,Tajikistan,Asia,38.3386,69.9728,4590.810725215695,4492.132230055238,55.631578809161965,Alice,Changchun,China,Asia,43.897,125.326,Frank,Frank,Changchun,China,Asia,43.897,125.326,Alice,Khovaling,Tajikistan,Asia,38.3386,69.9728,Dallas,Holstebro,Denmark,Europe,56.3595,8.6208
John lives in Béja. Richard lives in Vertentes. Hunter lives in Cadaval. The person who lives closest to John is,Cadaval,Portugal,Europe,39.25,-9.1,1623.5595486652937,1619.1699414381405,18.455699330559106,Hunter,Béja,Tunisia,Africa,36.7333,9.1833,John,John,Béja,Tunisia,Africa,36.7333,9.1833,Richard,Vertentes,Brazil,South America,-7.9028,-35.9878,Hunter,Cadaval,Portugal,Europe,39.25,-9.1
Leon lives in Tarbes. Mark lives in Lowell. Henry lives in Vesoul. The person who lives closest to Leon is,Vesoul,France,Europe,47.6231,6.1558,680.8981425325948,680.5741328498957,7.505750412183984,Henry,Tarbes,France,Europe,43.23,0.07,Leon,Leon,Tarbes,France,Europe,43.23,0.07,Mark,Lowell,United States,North America,42.6389,-71.3217,Henry,Vesoul,France,Europe,47.6231,6.1558
Aaron lives in Meschede. George lives in Limeira. Jason lives in Khaşab. The person who lives closest to Aaron is,Khaşab,Oman,Asia,26.1833,56.25,4887.685326524526,4768.7015921042075,54.16795268219023,Jason,Meschede,Germany,Europe,51.35,8.2833,Aaron,Aaron,Meschede,Germany,Europe,51.35,8.2833,George,Limeira,Brazil,South America,-22.5647,-47.4017,Jason,Khaşab,Oman,Asia,26.1833,56.25
Maria lives in Ambatondrazaka. Henry lives in Jalapa. Rose lives in As Samāwah. The person who lives closest to Maria is,As Samāwah,Iraq,Asia,31.3167,45.2833,5475.419601964608,5308.45855068247,49.24937944502448,Rose,Ambatondrazaka,Madagascar,Africa,-17.8329,48.4167,Maria,Maria,Ambatondrazaka,Madagascar,Africa,-17.8329,48.4167,Henry,Jalapa,Mexico,North America,17.7,-92.8,Rose,As Samāwah,Iraq,Asia,31.3167,45.2833
Ryan lives in Caracol. Jack lives in Gimpo. Neil lives in Alta. The person who lives closest to Ryan is,Alta,Norway,Europe,69.9686,23.2714,10117.363707419703,9087.273688283802,103.51769287522787,Neil,Caracol,Brazil,South America,-9.2789,-43.33,Ryan,Ryan,Caracol,Brazil,South America,-9.2789,-43.33,Jack,Gimpo,"Korea, South",Asia,37.7,126.6,Neil,Alta,Norway,Europe,69.9686,23.2714
Fred lives in Oleksandriia. Martin lives in Metairie. William lives in Star Dojran. The person who lives closest to Fred is,Star Dojran,North Macedonia,Europe,41.1865,22.7203,1164.9136940301923,1163.2916101728238,12.807752535085925,William,Oleksandriia,Ukraine,Europe,48.6667,33.1167,Fred,Fred,Oleksandriia,Ukraine,Europe,48.6667,33.1167,Martin,Metairie,United States,North America,29.9977,-90.178,William,Star Dojran,North Macedonia,Europe,41.1865,22.7203
