name_1,date_1,name_2,date_2,name_3,date_3,context,correct_date,correct_answer
Dallas,2019-02-26,Rachel,2019-01-21,Jerry,2019-01-15,Dallas filled out the application on the 26th of February. Rachel filled out the application on the 21st of January. Jerry filled out the application on the 15th of January. The first person that filled out the application was,2019-01-15,Jerry
Mark,2019-01-28,Walker,2019-02-27,Kevin,2019-02-15,Mark attended a wedding on the 28th of January. Walker attended a wedding on the 27th of February. Kevin attended a wedding on the 15th of February. The first person that attended a wedding was,2019-01-28,Mark
Fred,2019-01-26,Maria,2019-02-01,Richard,2019-02-20,Fred went to the gym on the 26th of January. Maria went to the gym on the 1st of February. Richard went to the gym on the 20th of February. The first person that went to the gym was,2019-01-26,Fred
Kevin,2019-02-27,Hunter,2019-01-19,Laura,2019-01-21,Kevin attended a graduation on the 27th of February. Hunter attended a graduation on the 19th of January. Laura attended a graduation on the 21st of January. The first person that attended a graduation was,2019-01-19,Hunter
Steve,2019-01-05,Jack,2019-01-16,Kyle,2019-02-19,Steve cleaned the attic on the 5th of January. Jack cleaned the attic on the 16th of January. Kyle cleaned the attic on the 19th of February. The first person that cleaned the attic was,2019-01-05,Steve
Kevin,2019-02-28,Emily,2019-01-13,Ryan,2019-02-13,Kevin bought a new car on the 28th of February. Emily bought a new car on the 13th of January. Ryan bought a new car on the 13th of February. The first person that bought a new car was,2019-01-13,Emily
Emily,2019-01-28,Robert,2019-02-26,Frank,2019-02-22,Emily received a letter on the 28th of January. Robert received a letter on the 26th of February. Frank received a letter on the 22nd of February. The first person that received a letter was,2019-01-28,Emily
Fred,2019-02-26,Connor,2019-01-03,Jerry,2019-02-13,Fred ran a marathon on the 26th of February. Connor ran a marathon on the 3rd of January. Jerry ran a marathon on the 13th of February. The first person that ran a marathon was,2019-01-03,Connor
Joy,2019-01-11,Dallas,2019-02-26,Neil,2019-02-23,Joy repaired the bike on the 11th of January. Dallas repaired the bike on the 26th of February. Neil repaired the bike on the 23rd of February. The first person that repaired the bike was,2019-01-11,Joy
Laura,2019-01-17,Neil,2019-02-12,April,2019-01-15,Laura wrote a letter on the 17th of January. Neil wrote a letter on the 12th of February. April wrote a letter on the 15th of January. The first person that wrote a letter was,2019-01-15,April
Bob,2019-02-11,Laura,2019-01-17,Jason,2019-02-08,Bob cleaned the basement on the 11th of February. Laura cleaned the basement on the 17th of January. Jason cleaned the basement on the 8th of February. The first person that cleaned the basement was,2019-01-17,Laura
Ryan,2019-01-13,Laura,2019-02-25,Luke,2019-02-26,Ryan compiled the spreadsheet on the 13th of January. Laura compiled the spreadsheet on the 25th of February. Luke compiled the spreadsheet on the 26th of February. The first person that compiled the spreadsheet was,2019-01-13,Ryan
William,2019-01-25,Rachel,2019-01-21,Hope,2019-01-26,William got a birthday gift on the 25th of January. Rachel got a birthday gift on the 21st of January. Hope got a birthday gift on the 26th of January. The first person that got a birthday gift was,2019-01-21,Rachel
Maria,2019-01-13,Hunter,2019-02-05,Ryan,2019-02-13,Maria went fishing on the 13th of January. Hunter went fishing on the 5th of February. Ryan went fishing on the 13th of February. The first person that went fishing was,2019-01-13,Maria
Laura,2019-02-11,Rachel,2019-02-14,Jerry,2019-01-15,Laura reorganized the closet on the 11th of February. Rachel reorganized the closet on the 14th of February. Jerry reorganized the closet on the 15th of January. The first person that reorganized the closet was,2019-01-15,Jerry
Walker,2019-02-05,Ian,2019-01-13,Jerry,2019-01-01,Walker purchased a new laptop on the 5th of February. Ian purchased a new laptop on the 13th of January. Jerry purchased a new laptop on the 1st of January. The first person that purchased a new laptop was,2019-01-01,Jerry
Rachel,2019-01-26,William,2019-01-25,Maria,2019-01-13,Rachel took a walk in the park on the 26th of January. William took a walk in the park on the 25th of January. Maria took a walk in the park on the 13th of January. The first person that took a walk in the park was,2019-01-13,Maria
Peter,2019-02-04,George,2019-01-25,Aaron,2019-01-29,Peter arrived in Germany on the 4th of February. George arrived in Germany on the 25th of January. Aaron arrived in Germany on the 29th of January. The first person that arrived in Germany was,2019-01-25,George
Michael,2019-01-29,Robert,2019-01-03,Mark,2019-01-28,Michael visited their family on the 29th of January. Robert visited their family on the 3rd of January. Mark visited their family on the 28th of January. The first person that visited their family was,2019-01-03,Robert
Blake,2019-01-07,Aaron,2019-02-08,Connor,2019-02-20,Blake took a ferry on the 7th of January. Aaron took a ferry on the 8th of February. Connor took a ferry on the 20th of February. The first person that took a ferry was,2019-01-07,Blake
Tyler,2019-01-12,Hunter,2019-01-08,Fred,2019-01-26,Tyler attended a funeral on the 12th of January. Hunter attended a funeral on the 8th of January. Fred attended a funeral on the 26th of January. The first person that attended a funeral was,2019-01-08,Hunter
Laura,2019-01-14,April,2019-01-15,Mark,2019-01-28,Laura cleaned the garage on the 14th of January. April cleaned the garage on the 15th of January. Mark cleaned the garage on the 28th of January. The first person that cleaned the garage was,2019-01-14,Laura
Richard,2019-02-05,Mark,2019-01-15,Laura,2019-01-17,Richard painted a portrait on the 5th of February. Mark painted a portrait on the 15th of January. Laura painted a portrait on the 17th of January. The first person that painted a portrait was,2019-01-15,Mark
Ryan,2019-02-23,Richard,2019-01-15,Laura,2019-02-03,Ryan took a ferry on the 23rd of February. Richard took a ferry on the 15th of January. Laura took a ferry on the 3rd of February. The first person that took a ferry was,2019-01-15,Richard
Jack,2019-02-01,Bob,2019-01-26,Josh,2019-02-27,Jack took a plane on the 1st of February. Bob took a plane on the 26th of January. Josh took a plane on the 27th of February. The first person that took a plane was,2019-01-26,Bob
Dallas,2019-01-07,Fred,2019-02-01,Kevin,2019-02-28,Dallas had a barbecue on the 7th of January. Fred had a barbecue on the 1st of February. Kevin had a barbecue on the 28th of February. The first person that had a barbecue was,2019-01-07,Dallas
Dean,2019-02-19,April,2019-02-15,Laura,2019-02-02,Dean harvested a garden on the 19th of February. April harvested a garden on the 15th of February. Laura harvested a garden on the 2nd of February. The first person that harvested a garden was,2019-02-02,Laura
Frank,2019-02-20,Hope,2019-01-26,Alice,2019-02-22,Frank washed the floors on the 20th of February. Hope washed the floors on the 26th of January. Alice washed the floors on the 22nd of February. The first person that washed the floors was,2019-01-26,Hope
Maria,2019-01-26,Kevin,2019-02-15,Bob,2019-02-11,Maria threw a party on the 26th of January. Kevin threw a party on the 15th of February. Bob threw a party on the 11th of February. The first person that threw a party was,2019-01-26,Maria
Kevin,2019-02-28,Emily,2019-01-29,Steve,2019-01-05,Kevin baked a cake on the 28th of February. Emily baked a cake on the 29th of January. Steve baked a cake on the 5th of January. The first person that baked a cake was,2019-01-05,Steve
Mark,2019-01-28,Steve,2019-02-03,Andrew,2019-01-12,Mark went to a Thai restaurant on the 28th of January. Steve went to a Thai restaurant on the 3rd of February. Andrew went to a Thai restaurant on the 12th of January. The first person that went to a Thai restaurant was,2019-01-12,Andrew
Ian,2019-02-14,Laura,2019-02-02,Walker,2019-01-13,Ian went to a French restaurant on the 14th of February. Laura went to a French restaurant on the 2nd of February. Walker went to a French restaurant on the 13th of January. The first person that went to a French restaurant was,2019-01-13,Walker
Peter,2019-02-04,Mark,2019-01-28,Henry,2019-02-16,Peter took an exam on the 4th of February. Mark took an exam on the 28th of January. Henry took an exam on the 16th of February. The first person that took an exam was,2019-01-28,Mark
Laura,2019-01-01,Hope,2019-01-26,Bob,2019-01-07,Laura cooked lasagna on the 1st of January. Hope cooked lasagna on the 26th of January. Bob cooked lasagna on the 7th of January. The first person that cooked lasagna was,2019-01-01,Laura
Andrew,2019-01-12,Jerry,2019-01-15,Joy,2019-01-19,Andrew went fishing on the 12th of January. Jerry went fishing on the 15th of January. Joy went fishing on the 19th of January. The first person that went fishing was,2019-01-12,Andrew
Kyle,2019-01-22,Robert,2019-02-26,Neil,2019-02-12,Kyle watered the plants on the 22nd of January. Robert watered the plants on the 26th of February. Neil watered the plants on the 12th of February. The first person that watered the plants was,2019-01-22,Kyle
Emily,2019-02-22,Michael,2019-01-25,Richard,2019-02-05,Emily took a taxi on the 22nd of February. Michael took a taxi on the 25th of January. Richard took a taxi on the 5th of February. The first person that took a taxi was,2019-01-25,Michael
Neil,2019-02-12,Fred,2019-01-08,Maria,2019-02-01,Neil painted a mural on the 12th of February. Fred painted a mural on the 8th of January. Maria painted a mural on the 1st of February. The first person that painted a mural was,2019-01-08,Fred
Blake,2019-01-25,Dean,2019-02-19,Kevin,2019-01-03,Blake went to a Chinese restaurant on the 25th of January. Dean went to a Chinese restaurant on the 19th of February. Kevin went to a Chinese restaurant on the 3rd of January. The first person that went to a Chinese restaurant was,2019-01-03,Kevin
Charlie,2019-02-20,Hunter,2019-01-08,Bob,2019-01-07,Charlie cleaned the garage on the 20th of February. Hunter cleaned the garage on the 8th of January. Bob cleaned the garage on the 7th of January. The first person that cleaned the garage was,2019-01-07,Bob
Bob,2019-02-11,Joy,2019-02-25,Luke,2019-01-14,Bob watched a documentary on the 11th of February. Joy watched a documentary on the 25th of February. Luke watched a documentary on the 14th of January. The first person that watched a documentary was,2019-01-14,Luke
Blake,2019-01-25,Jack,2019-02-13,Maria,2019-01-05,Blake won a contest on the 25th of January. Jack won a contest on the 13th of February. Maria won a contest on the 5th of January. The first person that won a contest was,2019-01-05,Maria
Rose,2019-01-02,Tyler,2019-02-05,Emily,2019-02-22,Rose took an exam on the 2nd of January. Tyler took an exam on the 5th of February. Emily took an exam on the 22nd of February. The first person that took an exam was,2019-01-02,Rose
Brandon,2019-01-18,Hope,2019-01-26,Frank,2019-01-09,Brandon moved to a new city on the 18th of January. Hope moved to a new city on the 26th of January. Frank moved to a new city on the 9th of January. The first person that moved to a new city was,2019-01-09,Frank
Aaron,2019-02-08,Tyler,2019-01-29,Michael,2019-01-15,Aaron went to a French restaurant on the 8th of February. Tyler went to a French restaurant on the 29th of January. Michael went to a French restaurant on the 15th of January. The first person that went to a French restaurant was,2019-01-15,Michael
Ryan,2019-02-13,Luke,2019-01-14,Rachel,2019-02-14,Ryan got a raise on the 13th of February. Luke got a raise on the 14th of January. Rachel got a raise on the 14th of February. The first person that got a raise was,2019-01-14,Luke
Fred,2019-02-26,Hope,2019-01-01,Richard,2019-01-15,Fred took a ferry on the 26th of February. Hope took a ferry on the 1st of January. Richard took a ferry on the 15th of January. The first person that took a ferry was,2019-01-01,Hope
Kevin,2019-02-28,Robert,2019-01-11,Rachel,2019-01-21,Kevin cooked lasagna on the 28th of February. Robert cooked lasagna on the 11th of January. Rachel cooked lasagna on the 21st of January. The first person that cooked lasagna was,2019-01-11,Robert
Charlie,2019-02-14,Henry,2019-02-16,Aaron,2019-01-26,Charlie arrived in the US on the 14th of February. Henry arrived in the US on the 16th of February. Aaron arrived in the US on the 26th of January. The first person that arrived in the US was,2019-01-26,Aaron
Richard,2019-01-15,Rachel,2019-01-21,Alex,2019-02-22,Richard attended a funeral on the 15th of January. Rachel attended a funeral on the 21st of January. Alex attended a funeral on the 22nd of February. The first person that attended a funeral was,2019-01-15,Richard
Tyler,2019-01-12,Rachel,2019-01-30,Max,2019-01-16,Tyler passed an exam on the 12th of January. Rachel passed an exam on the 30th of January. Max passed an exam on the 16th of January. The first person that passed an exam was,2019-01-12,Tyler
Laura,2019-02-11,Fred,2019-01-26,Frank,2019-02-22,Laura mowed the lawn on the 11th of February. Fred mowed the lawn on the 26th of January. Frank mowed the lawn on the 22nd of February. The first person that mowed the lawn was,2019-01-26,Fred
Maria,2019-01-26,George,2019-02-23,Rachel,2019-01-21,Maria went to a Thai restaurant on the 26th of January. George went to a Thai restaurant on the 23rd of February. Rachel went to a Thai restaurant on the 21st of January. The first person that went to a Thai restaurant was,2019-01-21,Rachel
Peter,2019-01-07,Ian,2019-01-13,Emily,2019-02-20,Peter took a boat on the 7th of January. Ian took a boat on the 13th of January. Emily took a boat on the 20th of February. The first person that took a boat was,2019-01-07,Peter
Charlie,2019-02-14,Rachel,2019-01-26,Laura,2019-01-14,Charlie visited a new country on the 14th of February. Rachel visited a new country on the 26th of January. Laura visited a new country on the 14th of January. The first person that visited a new country was,2019-01-14,Laura
Dallas,2019-01-07,Emily,2019-02-22,Max,2019-02-08,Dallas arrived in Canada on the 7th of January. Emily arrived in Canada on the 22nd of February. Max arrived in Canada on the 8th of February. The first person that arrived in Canada was,2019-01-07,Dallas
Bob,2019-01-07,Dallas,2019-02-26,Jerry,2019-01-28,Bob sold their car on the 7th of January. Dallas sold their car on the 26th of February. Jerry sold their car on the 28th of January. The first person that sold their car was,2019-01-07,Bob
Fred,2019-01-12,Laura,2019-01-17,Mark,2019-01-28,Fred cooked lasagna on the 12th of January. Laura cooked lasagna on the 17th of January. Mark cooked lasagna on the 28th of January. The first person that cooked lasagna was,2019-01-12,Fred
Marco,2019-01-21,Laura,2019-02-03,Rachel,2019-01-26,Marco went fishing on the 21st of January. Laura went fishing on the 3rd of February. Rachel went fishing on the 26th of January. The first person that went fishing was,2019-01-21,Marco
Connor,2019-01-03,Brandon,2019-02-21,Blake,2019-01-07,Connor wrote a letter on the 3rd of January. Brandon wrote a letter on the 21st of February. Blake wrote a letter on the 7th of January. The first person that wrote a letter was,2019-01-03,Connor
Brandon,2019-02-21,Maria,2019-01-14,Jason,2019-02-12,Brandon got a raise on the 21st of February. Maria got a raise on the 14th of January. Jason got a raise on the 12th of February. The first person that got a raise was,2019-01-14,Maria
Kevin,2019-02-08,Hope,2019-02-17,Alex,2019-01-08,Kevin took a taxi on the 8th of February. Hope took a taxi on the 17th of February. Alex took a taxi on the 8th of January. The first person that took a taxi was,2019-01-08,Alex
Richard,2019-02-05,Andrew,2019-02-26,Michael,2019-01-15,Richard visited their family on the 5th of February. Andrew visited their family on the 26th of February. Michael visited their family on the 15th of January. The first person that visited their family was,2019-01-15,Michael
Kyle,2019-02-24,Marco,2019-01-26,Max,2019-01-16,Kyle ran a marathon on the 24th of February. Marco ran a marathon on the 26th of January. Max ran a marathon on the 16th of January. The first person that ran a marathon was,2019-01-16,Max
Andrew,2019-01-12,Laura,2019-02-11,Emily,2019-02-20,Andrew visited their family on the 12th of January. Laura visited their family on the 11th of February. Emily visited their family on the 20th of February. The first person that visited their family was,2019-01-12,Andrew
Robert,2019-01-11,Kevin,2019-01-03,Kyle,2019-02-22,Robert ironed the clothes on the 11th of January. Kevin ironed the clothes on the 3rd of January. Kyle ironed the clothes on the 22nd of February. The first person that ironed the clothes was,2019-01-03,Kevin
Robert,2019-02-26,Jerry,2019-01-20,Jason,2019-02-08,Robert watched a documentary on the 26th of February. Jerry watched a documentary on the 20th of January. Jason watched a documentary on the 8th of February. The first person that watched a documentary was,2019-01-20,Jerry
Jack,2019-02-18,Kevin,2019-01-02,April,2019-02-24,Jack went fishing on the 18th of February. Kevin went fishing on the 2nd of January. April went fishing on the 24th of February. The first person that went fishing was,2019-01-02,Kevin
Bob,2019-02-11,Charlie,2019-01-09,Laura,2019-02-18,Bob went to the cinema on the 11th of February. Charlie went to the cinema on the 9th of January. Laura went to the cinema on the 18th of February. The first person that went to the cinema was,2019-01-09,Charlie
Jerry,2019-02-13,Frank,2019-01-09,Max,2019-01-16,Jerry took a taxi on the 13th of February. Frank took a taxi on the 9th of January. Max took a taxi on the 16th of January. The first person that took a taxi was,2019-01-09,Frank
Dean,2019-02-19,Ryan,2019-01-30,Frank,2019-02-20,Dean arrived in France on the 19th of February. Ryan arrived in France on the 30th of January. Frank arrived in France on the 20th of February. The first person that arrived in France was,2019-01-30,Ryan
Jason,2019-02-12,Jerry,2019-01-15,Kevin,2019-02-15,Jason watered the plants on the 12th of February. Jerry watered the plants on the 15th of January. Kevin watered the plants on the 15th of February. The first person that watered the plants was,2019-01-15,Jerry
Andrew,2019-02-22,Bob,2019-01-26,Rachel,2019-01-21,Andrew got a birthday gift on the 22nd of February. Bob got a birthday gift on the 26th of January. Rachel got a birthday gift on the 21st of January. The first person that got a birthday gift was,2019-01-21,Rachel
Dallas,2019-01-07,Fred,2019-01-26,Ryan,2019-01-22,Dallas painted a mural on the 7th of January. Fred painted a mural on the 26th of January. Ryan painted a mural on the 22nd of January. The first person that painted a mural was,2019-01-07,Dallas
Fred,2019-01-26,Charlie,2019-02-20,Henry,2019-01-10,Fred went to an Indian restaurant on the 26th of January. Charlie went to an Indian restaurant on the 20th of February. Henry went to an Indian restaurant on the 10th of January. The first person that went to an Indian restaurant was,2019-01-10,Henry
Ryan,2019-01-22,William,2019-01-25,Charlie,2019-01-09,Ryan visited a new country on the 22nd of January. William visited a new country on the 25th of January. Charlie visited a new country on the 9th of January. The first person that visited a new country was,2019-01-09,Charlie
Brandon,2019-02-23,Richard,2019-02-05,Tyler,2019-01-12,Brandon repaired the bike on the 23rd of February. Richard repaired the bike on the 5th of February. Tyler repaired the bike on the 12th of January. The first person that repaired the bike was,2019-01-12,Tyler
Charlie,2019-02-20,Jerry,2019-02-13,Joy,2019-01-19,Charlie won a contest on the 20th of February. Jerry won a contest on the 13th of February. Joy won a contest on the 19th of January. The first person that won a contest was,2019-01-19,Joy
George,2019-02-12,Martin,2019-01-12,Hunter,2019-01-19,George bought a new car on the 12th of February. Martin bought a new car on the 12th of January. Hunter bought a new car on the 19th of January. The first person that bought a new car was,2019-01-12,Martin
Emily,2019-01-11,Ryan,2019-02-23,Mark,2019-01-28,Emily left for vacation on the 11th of January. Ryan left for vacation on the 23rd of February. Mark left for vacation on the 28th of January. The first person that left for vacation was,2019-01-11,Emily
Luke,2019-01-14,Jerry,2019-01-01,Emily,2019-01-22,Luke took a walk in the park on the 14th of January. Jerry took a walk in the park on the 1st of January. Emily took a walk in the park on the 22nd of January. The first person that took a walk in the park was,2019-01-01,Jerry
Jerry,2019-01-01,Rachel,2019-01-21,Rose,2019-01-02,Jerry cleaned the windows on the 1st of January. Rachel cleaned the windows on the 21st of January. Rose cleaned the windows on the 2nd of January. The first person that cleaned the windows was,2019-01-01,Jerry
Ryan,2019-01-13,Alex,2019-02-01,Jason,2019-02-08,Ryan got a birthday gift on the 13th of January. Alex got a birthday gift on the 1st of February. Jason got a birthday gift on the 8th of February. The first person that got a birthday gift was,2019-01-13,Ryan
Martin,2019-03-26,Dean,2019-04-10,Rose,2019-03-03,Martin took a walk in the park on the 26th of March. Dean took a walk in the park on the 10th of April. Rose took a walk in the park on the 3rd of March. The first person that took a walk in the park was,2019-03-03,Rose
Marco,2019-03-24,Blake,2019-03-01,Frank,2019-04-07,Marco cleaned the shed on the 24th of March. Blake cleaned the shed on the 1st of March. Frank cleaned the shed on the 7th of April. The first person that cleaned the shed was,2019-03-01,Blake
Neil,2019-03-04,Dean,2019-04-20,Ryan,2019-04-18,Neil went to the cinema on the 4th of March. Dean went to the cinema on the 20th of April. Ryan went to the cinema on the 18th of April. The first person that went to the cinema was,2019-03-04,Neil
Jack,2019-03-05,Aaron,2019-04-06,Blake,2019-04-10,Jack watched a movie on the 5th of March. Aaron watched a movie on the 6th of April. Blake watched a movie on the 10th of April. The first person that watched a movie was,2019-03-05,Jack
Maria,2019-03-13,Fred,2019-03-07,Henry,2019-03-06,Maria alphabetized the bookshelf on the 13th of March. Fred alphabetized the bookshelf on the 7th of March. Henry alphabetized the bookshelf on the 6th of March. The first person that alphabetized the bookshelf was,2019-03-06,Henry
Jerry,2019-04-24,George,2019-03-01,Marco,2019-03-24,Jerry cleaned the attic on the 24th of April. George cleaned the attic on the 1st of March. Marco cleaned the attic on the 24th of March. The first person that cleaned the attic was,2019-03-01,George
Rachel,2019-04-28,Fred,2019-03-07,Scott,2019-04-15,Rachel took a train on the 28th of April. Fred took a train on the 7th of March. Scott took a train on the 15th of April. The first person that took a train was,2019-03-07,Fred
Luke,2019-04-28,Martin,2019-04-08,Neil,2019-03-08,Luke went to the zoo on the 28th of April. Martin went to the zoo on the 8th of April. Neil went to the zoo on the 8th of March. The first person that went to the zoo was,2019-03-08,Neil
Neil,2019-03-10,John,2019-03-13,Kevin,2019-04-06,Neil alphabetized the bookshelf on the 10th of March. John alphabetized the bookshelf on the 13th of March. Kevin alphabetized the bookshelf on the 6th of April. The first person that alphabetized the bookshelf was,2019-03-10,Neil
Rose,2019-04-14,Kyle,2019-03-21,Andrew,2019-04-20,Rose went to the gym on the 14th of April. Kyle went to the gym on the 21st of March. Andrew went to the gym on the 20th of April. The first person that went to the gym was,2019-03-21,Kyle
John,2019-03-21,Dean,2019-04-20,Neil,2019-03-19,John watched TV on the 21st of March. Dean watched TV on the 20th of April. Neil watched TV on the 19th of March. The first person that watched TV was,2019-03-19,Neil
Michael,2019-03-06,Dallas,2019-03-12,Max,2019-04-28,Michael got a massage on the 6th of March. Dallas got a massage on the 12th of March. Max got a massage on the 28th of April. The first person that got a massage was,2019-03-06,Michael
Neil,2019-03-08,Tyler,2019-04-07,Charlie,2019-03-30,Neil arrived in Spain on the 8th of March. Tyler arrived in Spain on the 7th of April. Charlie arrived in Spain on the 30th of March. The first person that arrived in Spain was,2019-03-08,Neil
Ryan,2019-04-12,Connor,2019-04-09,Rose,2019-04-28,Ryan went to a festival on the 12th of April. Connor went to a festival on the 9th of April. Rose went to a festival on the 28th of April. The first person that went to a festival was,2019-04-09,Connor
Aaron,2019-04-11,Charlie,2019-04-17,Jack,2019-03-05,Aaron moved to a new city on the 11th of April. Charlie moved to a new city on the 17th of April. Jack moved to a new city on the 5th of March. The first person that moved to a new city was,2019-03-05,Jack
Laura,2019-04-19,Charlie,2019-03-01,Marco,2019-04-29,Laura purchased a new laptop on the 19th of April. Charlie purchased a new laptop on the 1st of March. Marco purchased a new laptop on the 29th of April. The first person that purchased a new laptop was,2019-03-01,Charlie
Kyle,2019-03-21,Aaron,2019-04-06,Frank,2019-03-08,Kyle purchased a new laptop on the 21st of March. Aaron purchased a new laptop on the 6th of April. Frank purchased a new laptop on the 8th of March. The first person that purchased a new laptop was,2019-03-08,Frank
Dallas,2019-04-12,George,2019-04-28,William,2019-03-29,Dallas took a walk in the park on the 12th of April. George took a walk in the park on the 28th of April. William took a walk in the park on the 29th of March. The first person that took a walk in the park was,2019-03-29,William
