name_1,date_1,name_2,date_2,name_3,date_3,context,correct_date,correct_answer
George,2019-06-15,Michael,2019-06-27,Alice,2019-07-28,George took a ferry on the 15th of June. Michael took a ferry on the 27th of June. Alice took a ferry on the 28th of July. The first person that took a ferry was,2019-06-15,George
Mark,2019-07-03,Alice,2019-07-13,Bob,2019-07-19,Mark sold their car on the 3rd of July. Alice sold their car on the 13th of July. Bob sold their car on the 19th of July. The first person that sold their car was,2019-07-03,Mark
Kyle,2019-07-23,Fred,2019-06-21,Rachel,2019-07-01,Kyle left for vacation on the 23rd of July. Fred left for vacation on the 21st of June. Rachel left for vacation on the 1st of July. The first person that left for vacation was,2019-06-21,Fred
Peter,2019-07-26,Henry,2019-07-03,Martin,2019-06-10,Peter went to the beach on the 26th of July. Henry went to the beach on the 3rd of July. Martin went to the beach on the 10th of June. The first person that went to the beach was,2019-06-10,Martin
Kevin,2019-06-09,Walker,2019-07-13,Jason,2019-06-29,Kevin repotted the plants on the 9th of June. Walker repotted the plants on the 13th of July. Jason repotted the plants on the 29th of June. The first person that repotted the plants was,2019-06-09,Kevin
Fred,2019-06-21,Bob,2019-06-25,Peter,2019-06-26,Fred cleaned the basement on the 21st of June. Bob cleaned the basement on the 25th of June. Peter cleaned the basement on the 26th of June. The first person that cleaned the basement was,2019-06-21,Fred
Peter,2019-06-01,April,2019-07-14,Scott,2019-07-08,Peter watched TV on the 1st of June. April watched TV on the 14th of July. Scott watched TV on the 8th of July. The first person that watched TV was,2019-06-01,Peter
Hope,2019-06-22,Maria,2019-07-24,Peter,2019-07-29,Hope participated in a triathlon on the 22nd of June. Maria participated in a triathlon on the 24th of July. Peter participated in a triathlon on the 29th of July. The first person that participated in a triathlon was,2019-06-22,Hope
Maria,2019-06-28,Kevin,2019-07-05,Hope,2019-06-07,Maria refinanced the mortgage on the 28th of June. Kevin refinanced the mortgage on the 5th of July. Hope refinanced the mortgage on the 7th of June. The first person that refinanced the mortgage was,2019-06-07,Hope
Maria,2019-07-29,April,2019-07-11,Matt,2019-07-02,Maria attended a wedding on the 29th of July. April attended a wedding on the 11th of July. Matt attended a wedding on the 2nd of July. The first person that attended a wedding was,2019-07-02,Matt
Andrew,2019-07-09,Charlie,2019-06-01,Jack,2019-06-02,Andrew passed an exam on the 9th of July. Charlie passed an exam on the 1st of June. Jack passed an exam on the 2nd of June. The first person that passed an exam was,2019-06-01,Charlie
Ian,2019-07-02,Peter,2019-06-01,Henry,2019-07-15,Ian received a letter on the 2nd of July. Peter received a letter on the 1st of June. Henry received a letter on the 15th of July. The first person that received a letter was,2019-06-01,Peter
Jason,2019-07-23,Kevin,2019-07-01,Bob,2019-07-09,Jason played beer pong on the 23rd of July. Kevin played beer pong on the 1st of July. Bob played beer pong on the 9th of July. The first person that played beer pong was,2019-07-01,Kevin
Walker,2019-07-21,Emily,2019-06-06,Martin,2019-06-10,Walker received a letter on the 21st of July. Emily received a letter on the 6th of June. Martin received a letter on the 10th of June. The first person that received a letter was,2019-06-06,Emily
April,2019-07-11,Kyle,2019-07-02,Bob,2019-07-07,April cooked lasagna on the 11th of July. Kyle cooked lasagna on the 2nd of July. Bob cooked lasagna on the 7th of July. The first person that cooked lasagna was,2019-07-02,Kyle
Bob,2019-07-07,Richard,2019-07-30,Kyle,2019-06-30,Bob left for vacation on the 7th of July. Richard left for vacation on the 30th of July. Kyle left for vacation on the 30th of June. The first person that left for vacation was,2019-06-30,Kyle
Richard,2019-07-18,Jack,2019-07-16,George,2019-06-15,Richard sent a postcard on the 18th of July. Jack sent a postcard on the 16th of July. George sent a postcard on the 15th of June. The first person that sent a postcard was,2019-06-15,George
Brandon,2019-07-24,Jerry,2019-07-17,Steve,2019-07-12,Brandon went hiking on the 24th of July. Jerry went hiking on the 17th of July. Steve went hiking on the 12th of July. The first person that went hiking was,2019-07-12,Steve
Blake,2019-06-03,April,2019-06-19,Richard,2019-07-17,Blake repotted the plants on the 3rd of June. April repotted the plants on the 19th of June. Richard repotted the plants on the 17th of July. The first person that repotted the plants was,2019-06-03,Blake
Fred,2019-07-19,Ian,2019-07-02,Brandon,2019-07-15,Fred went to a Thai restaurant on the 19th of July. Ian went to a Thai restaurant on the 2nd of July. Brandon went to a Thai restaurant on the 15th of July. The first person that went to a Thai restaurant was,2019-07-02,Ian
Blake,2019-06-03,Brandon,2019-07-15,Michael,2019-06-27,Blake got a raise on the 3rd of June. Brandon got a raise on the 15th of July. Michael got a raise on the 27th of June. The first person that got a raise was,2019-06-03,Blake
Henry,2019-07-20,Jerry,2019-06-03,Hope,2019-06-22,Henry took an exam on the 20th of July. Jerry took an exam on the 3rd of June. Hope took an exam on the 22nd of June. The first person that took an exam was,2019-06-03,Jerry
Brandon,2019-07-15,Hope,2019-06-07,April,2019-06-21,Brandon called a friend on the 15th of July. Hope called a friend on the 7th of June. April called a friend on the 21st of June. The first person that called a friend was,2019-06-07,Hope
Alice,2019-07-13,Martin,2019-07-15,Kevin,2019-07-01,Alice cleaned the windows on the 13th of July. Martin cleaned the windows on the 15th of July. Kevin cleaned the windows on the 1st of July. The first person that cleaned the windows was,2019-07-01,Kevin
Brandon,2019-06-28,Peter,2019-07-01,Richard,2019-07-30,Brandon cleaned the windows on the 28th of June. Peter cleaned the windows on the 1st of July. Richard cleaned the windows on the 30th of July. The first person that cleaned the windows was,2019-06-28,Brandon
April,2019-06-21,Michael,2019-06-12,Maria,2019-06-08,April went to a Mexican restaurant on the 21st of June. Michael went to a Mexican restaurant on the 12th of June. Maria went to a Mexican restaurant on the 8th of June. The first person that went to a Mexican restaurant was,2019-06-08,Maria
Brandon,2019-06-24,Alice,2019-06-19,Jack,2019-07-16,Brandon arrived in France on the 24th of June. Alice arrived in France on the 19th of June. Jack arrived in France on the 16th of July. The first person that arrived in France was,2019-06-19,Alice
Peter,2019-06-20,Robert,2019-06-22,Hope,2019-06-07,Peter cooked cheesecake on the 20th of June. Robert cooked cheesecake on the 22nd of June. Hope cooked cheesecake on the 7th of June. The first person that cooked cheesecake was,2019-06-07,Hope
Rachel,2019-07-01,Kevin,2019-06-03,Peter,2019-07-29,Rachel watered the plants on the 1st of July. Kevin watered the plants on the 3rd of June. Peter watered the plants on the 29th of July. The first person that watered the plants was,2019-06-03,Kevin
Jason,2019-08-30,Rachel,2019-09-08,Richard,2019-08-23,Jason arrived in Germany on the 30th of August. Rachel arrived in Germany on the 8th of September. Richard arrived in Germany on the 23rd of August. The first person that arrived in Germany was,2019-08-23,Richard
Kyle,2019-08-03,Ryan,2019-08-12,Connor,2019-08-19,Kyle cleaned the basement on the 3rd of August. Ryan cleaned the basement on the 12th of August. Connor cleaned the basement on the 19th of August. The first person that cleaned the basement was,2019-08-03,Kyle
Connor,2019-08-02,Michael,2019-08-13,Robert,2019-08-23,Connor won a contest on the 2nd of August. Michael won a contest on the 13th of August. Robert won a contest on the 23rd of August. The first person that won a contest was,2019-08-02,Connor
Scott,2019-09-21,Leon,2019-08-04,Jerry,2019-08-24,Scott sent a postcard on the 21st of September. Leon sent a postcard on the 4th of August. Jerry sent a postcard on the 24th of August. The first person that sent a postcard was,2019-08-04,Leon
Steve,2019-08-25,Michael,2019-08-20,Laura,2019-08-26,Steve played chess on the 25th of August. Michael played chess on the 20th of August. Laura played chess on the 26th of August. The first person that played chess was,2019-08-20,Michael
Rose,2019-09-11,Dallas,2019-09-14,Bob,2019-09-18,Rose went to the beach on the 11th of September. Dallas went to the beach on the 14th of September. Bob went to the beach on the 18th of September. The first person that went to the beach was,2019-09-11,Rose
Steve,2019-08-26,Tyler,2019-08-30,Bob,2019-09-06,Steve wrote a letter on the 26th of August. Tyler wrote a letter on the 30th of August. Bob wrote a letter on the 6th of September. The first person that wrote a letter was,2019-08-26,Steve
Alice,2019-08-01,Aaron,2019-09-02,Hope,2019-08-12,Alice took a taxi on the 1st of August. Aaron took a taxi on the 2nd of September. Hope took a taxi on the 12th of August. The first person that took a taxi was,2019-08-01,Alice
Dean,2019-09-08,Bob,2019-09-18,Rose,2019-08-07,Dean left for vacation on the 8th of September. Bob left for vacation on the 18th of September. Rose left for vacation on the 7th of August. The first person that left for vacation was,2019-08-07,Rose
Jason,2019-08-30,Ian,2019-08-14,Fred,2019-08-01,Jason went fishing on the 30th of August. Ian went fishing on the 14th of August. Fred went fishing on the 1st of August. The first person that went fishing was,2019-08-01,Fred
Luke,2019-08-09,Neil,2019-08-06,Kyle,2019-09-18,Luke sent a postcard on the 9th of August. Neil sent a postcard on the 6th of August. Kyle sent a postcard on the 18th of September. The first person that sent a postcard was,2019-08-06,Neil
Emily,2019-08-11,Martin,2019-08-09,Leon,2019-09-05,Emily attended a graduation on the 11th of August. Martin attended a graduation on the 9th of August. Leon attended a graduation on the 5th of September. The first person that attended a graduation was,2019-08-09,Martin
Grant,2019-09-21,Connor,2019-08-02,Scott,2019-08-06,Grant built a desktop computer on the 21st of September. Connor built a desktop computer on the 2nd of August. Scott built a desktop computer on the 6th of August. The first person that built a desktop computer was,2019-08-02,Connor
Emily,2019-09-23,Tyler,2019-08-30,Andrew,2019-08-07,Emily received a promotion on the 23rd of September. Tyler received a promotion on the 30th of August. Andrew received a promotion on the 7th of August. The first person that received a promotion was,2019-08-07,Andrew
William,2019-08-14,Laura,2019-08-26,Rose,2019-08-07,William painted a portrait on the 14th of August. Laura painted a portrait on the 26th of August. Rose painted a portrait on the 7th of August. The first person that painted a portrait was,2019-08-07,Rose
Jason,2019-08-05,Robert,2019-09-06,Emily,2019-08-09,Jason painted a mural on the 5th of August. Robert painted a mural on the 6th of September. Emily painted a mural on the 9th of August. The first person that painted a mural was,2019-08-05,Jason
Connor,2019-08-02,Bob,2019-09-06,Maria,2019-08-25,Connor compiled the spreadsheet on the 2nd of August. Bob compiled the spreadsheet on the 6th of September. Maria compiled the spreadsheet on the 25th of August. The first person that compiled the spreadsheet was,2019-08-02,Connor
Bob,2019-09-06,Marco,2019-09-03,Alice,2019-08-01,Bob donated toys on the 6th of September. Marco donated toys on the 3rd of September. Alice donated toys on the 1st of August. The first person that donated toys was,2019-08-01,Alice
Peter,2019-09-18,Jack,2019-08-30,Leon,2019-08-07,Peter got a manicure on the 18th of September. Jack got a manicure on the 30th of August. Leon got a manicure on the 7th of August. The first person that got a manicure was,2019-08-07,Leon
Andrew,2019-08-28,Michael,2019-08-20,Steve,2019-09-12,Andrew bought a new car on the 28th of August. Michael bought a new car on the 20th of August. Steve bought a new car on the 12th of September. The first person that bought a new car was,2019-08-20,Michael
Aaron,2019-08-04,Andrew,2019-09-08,Neil,2019-08-06,Aaron went to the museum on the 4th of August. Andrew went to the museum on the 8th of September. Neil went to the museum on the 6th of August. The first person that went to the museum was,2019-08-04,Aaron
Bob,2019-09-09,Jack,2019-08-23,John,2019-08-05,Bob passed an exam on the 9th of September. Jack passed an exam on the 23rd of August. John passed an exam on the 5th of August. The first person that passed an exam was,2019-08-05,John
Fred,2019-09-24,Ian,2019-08-14,Tyler,2019-08-30,Fred reorganized the closet on the 24th of September. Ian reorganized the closet on the 14th of August. Tyler reorganized the closet on the 30th of August. The first person that reorganized the closet was,2019-08-14,Ian
Marco,2019-09-03,Alice,2019-08-01,Jerry,2019-09-16,Marco went to the beach on the 3rd of September. Alice went to the beach on the 1st of August. Jerry went to the beach on the 16th of September. The first person that went to the beach was,2019-08-01,Alice
Emily,2019-09-23,Peter,2019-09-18,Neil,2019-09-01,Emily donated toys on the 23rd of September. Peter donated toys on the 18th of September. Neil donated toys on the 1st of September. The first person that donated toys was,2019-09-01,Neil
Max,2019-08-14,Rose,2019-08-07,Fred,2019-09-24,Max renovated the bathroom on the 14th of August. Rose renovated the bathroom on the 7th of August. Fred renovated the bathroom on the 24th of September. The first person that renovated the bathroom was,2019-08-07,Rose
Kevin,2019-09-29,Joy,2019-09-24,Jason,2019-08-05,Kevin had a picnic on the 29th of September. Joy had a picnic on the 24th of September. Jason had a picnic on the 5th of August. The first person that had a picnic was,2019-08-05,Jason
Peter,2019-08-30,Ryan,2019-08-04,Luke,2019-08-09,Peter took an exam on the 30th of August. Ryan took an exam on the 4th of August. Luke took an exam on the 9th of August. The first person that took an exam was,2019-08-04,Ryan
Robert,2019-08-23,Jason,2019-09-29,Leon,2019-09-05,Robert took a boat on the 23rd of August. Jason took a boat on the 29th of September. Leon took a boat on the 5th of September. The first person that took a boat was,2019-08-23,Robert
George,2019-08-07,Bob,2019-08-03,Henry,2019-09-12,George went hiking on the 7th of August. Bob went hiking on the 3rd of August. Henry went hiking on the 12th of September. The first person that went hiking was,2019-08-03,Bob
Fred,2019-09-20,Hunter,2019-09-02,Peter,2019-08-01,Fred arrived in France on the 20th of September. Hunter arrived in France on the 2nd of September. Peter arrived in France on the 1st of August. The first person that arrived in France was,2019-08-01,Peter
Jerry,2019-08-24,Kyle,2019-09-06,Mark,2019-09-02,Jerry won a contest on the 24th of August. Kyle won a contest on the 6th of September. Mark won a contest on the 2nd of September. The first person that won a contest was,2019-08-24,Jerry
Matt,2019-08-03,George,2019-08-07,Neil,2019-09-22,Matt went to the beach on the 3rd of August. George went to the beach on the 7th of August. Neil went to the beach on the 22nd of September. The first person that went to the beach was,2019-08-03,Matt
Scott,2019-09-21,Robert,2019-09-09,Jerry,2019-09-16,Scott went camping on the 21st of September. Robert went camping on the 9th of September. Jerry went camping on the 16th of September. The first person that went camping was,2019-09-09,Robert
Dean,2019-09-08,John,2019-09-16,Fred,2019-08-01,Dean had a picnic on the 8th of September. John had a picnic on the 16th of September. Fred had a picnic on the 1st of August. The first person that had a picnic was,2019-08-01,Fred
Kyle,2019-09-27,Maria,2019-09-18,John,2019-09-01,Kyle repotted the plants on the 27th of September. Maria repotted the plants on the 18th of September. John repotted the plants on the 1st of September. The first person that repotted the plants was,2019-09-01,John
Peter,2019-09-18,Fred,2019-08-04,Ryan,2019-09-20,Peter repaired the bike on the 18th of September. Fred repaired the bike on the 4th of August. Ryan repaired the bike on the 20th of September. The first person that repaired the bike was,2019-08-04,Fred
Ryan,2019-09-20,Richard,2019-09-15,Scott,2019-08-06,Ryan took an exam on the 20th of September. Richard took an exam on the 15th of September. Scott took an exam on the 6th of August. The first person that took an exam was,2019-08-06,Scott
Hunter,2019-09-02,Jack,2019-08-25,Martin,2019-08-23,Hunter compiled the spreadsheet on the 2nd of September. Jack compiled the spreadsheet on the 25th of August. Martin compiled the spreadsheet on the 23rd of August. The first person that compiled the spreadsheet was,2019-08-23,Martin
Fred,2019-08-04,Connor,2019-09-08,Kyle,2019-09-27,Fred went to a French restaurant on the 4th of August. Connor went to a French restaurant on the 8th of September. Kyle went to a French restaurant on the 27th of September. The first person that went to a French restaurant was,2019-08-04,Fred
Scott,2019-08-06,Michael,2019-09-24,Jack,2019-08-25,Scott went to a Mexican restaurant on the 6th of August. Michael went to a Mexican restaurant on the 24th of September. Jack went to a Mexican restaurant on the 25th of August. The first person that went to a Mexican restaurant was,2019-08-06,Scott
Scott,2019-09-21,Dallas,2019-09-14,Leon,2019-08-07,Scott arrived in Germany on the 21st of September. Dallas arrived in Germany on the 14th of September. Leon arrived in Germany on the 7th of August. The first person that arrived in Germany was,2019-08-07,Leon
Jerry,2019-09-16,Henry,2019-09-27,Martin,2019-08-23,Jerry washed the dog on the 16th of September. Henry washed the dog on the 27th of September. Martin washed the dog on the 23rd of August. The first person that washed the dog was,2019-08-23,Martin
Bob,2019-08-03,Max,2019-08-28,Leon,2019-08-05,Bob donated clothes on the 3rd of August. Max donated clothes on the 28th of August. Leon donated clothes on the 5th of August. The first person that donated clothes was,2019-08-03,Bob
Kyle,2019-09-21,Luke,2019-08-09,Matt,2019-08-03,Kyle cooked lasagna on the 21st of September. Luke cooked lasagna on the 9th of August. Matt cooked lasagna on the 3rd of August. The first person that cooked lasagna was,2019-08-03,Matt
Neil,2019-09-01,Jerry,2019-08-24,Josh,2019-09-25,Neil returned from vacation on the 1st of September. Jerry returned from vacation on the 24th of August. Josh returned from vacation on the 25th of September. The first person that returned from vacation was,2019-08-24,Jerry
Martin,2019-08-23,George,2019-08-07,Fred,2019-08-01,Martin mowed the lawn on the 23rd of August. George mowed the lawn on the 7th of August. Fred mowed the lawn on the 1st of August. The first person that mowed the lawn was,2019-08-01,Fred
Richard,2019-09-15,Michael,2019-08-13,Peter,2019-08-30,Richard renovated the bathroom on the 15th of September. Michael renovated the bathroom on the 13th of August. Peter renovated the bathroom on the 30th of August. The first person that renovated the bathroom was,2019-08-13,Michael
Max,2019-09-01,Tyler,2019-08-30,Rachel,2019-08-08,Max went to a Thai restaurant on the 1st of September. Tyler went to a Thai restaurant on the 30th of August. Rachel went to a Thai restaurant on the 8th of August. The first person that went to a Thai restaurant was,2019-08-08,Rachel
Ryan,2019-08-04,Kyle,2019-08-08,Rachel,2019-09-01,Ryan washed the dog on the 4th of August. Kyle washed the dog on the 8th of August. Rachel washed the dog on the 1st of September. The first person that washed the dog was,2019-08-04,Ryan
Josh,2019-08-04,Andrew,2019-08-07,Dallas,2019-09-02,Josh cleaned the basement on the 4th of August. Andrew cleaned the basement on the 7th of August. Dallas cleaned the basement on the 2nd of September. The first person that cleaned the basement was,2019-08-04,Josh
Jack,2019-08-30,Fred,2019-08-04,Leon,2019-09-05,Jack moved to a new city on the 30th of August. Fred moved to a new city on the 4th of August. Leon moved to a new city on the 5th of September. The first person that moved to a new city was,2019-08-04,Fred
Rachel,2019-08-29,Neil,2019-08-06,Rose,2019-09-09,Rachel cleaned the windows on the 29th of August. Neil cleaned the windows on the 6th of August. Rose cleaned the windows on the 9th of September. The first person that cleaned the windows was,2019-08-06,Neil
Maria,2019-08-30,Jason,2019-09-29,Leon,2019-08-04,Maria received a promotion on the 30th of August. Jason received a promotion on the 29th of September. Leon received a promotion on the 4th of August. The first person that received a promotion was,2019-08-04,Leon
Leon,2019-08-04,Rose,2019-08-07,Bob,2019-09-09,Leon went to a French restaurant on the 4th of August. Rose went to a French restaurant on the 7th of August. Bob went to a French restaurant on the 9th of September. The first person that went to a French restaurant was,2019-08-04,Leon
Bob,2019-09-06,Laura,2019-08-13,Joy,2019-08-08,Bob left for vacation on the 6th of September. Laura left for vacation on the 13th of August. Joy left for vacation on the 8th of August. The first person that left for vacation was,2019-08-08,Joy
Jerry,2019-08-24,Frank,2019-09-30,Leon,2019-08-04,Jerry refinanced the mortgage on the 24th of August. Frank refinanced the mortgage on the 30th of September. Leon refinanced the mortgage on the 4th of August. The first person that refinanced the mortgage was,2019-08-04,Leon
Dallas,2019-09-02,Ryan,2019-08-12,Joy,2019-08-09,Dallas took a taxi on the 2nd of September. Ryan took a taxi on the 12th of August. Joy took a taxi on the 9th of August. The first person that took a taxi was,2019-08-09,Joy
Steve,2019-08-26,Richard,2019-08-23,Michael,2019-09-24,Steve got a birthday gift on the 26th of August. Richard got a birthday gift on the 23rd of August. Michael got a birthday gift on the 24th of September. The first person that got a birthday gift was,2019-08-23,Richard
Robert,2019-08-03,Michael,2019-09-24,Emily,2019-08-26,Robert renovated the bathroom on the 3rd of August. Michael renovated the bathroom on the 24th of September. Emily renovated the bathroom on the 26th of August. The first person that renovated the bathroom was,2019-08-03,Robert
Laura,2019-08-26,Maria,2019-09-18,Leon,2019-08-07,Laura arrived in France on the 26th of August. Maria arrived in France on the 18th of September. Leon arrived in France on the 7th of August. The first person that arrived in France was,2019-08-07,Leon
Richard,2019-08-12,Peter,2019-08-01,Henry,2019-08-07,Richard arrived in Italy on the 12th of August. Peter arrived in Italy on the 1st of August. Henry arrived in Italy on the 7th of August. The first person that arrived in Italy was,2019-08-01,Peter
Steve,2019-09-25,Kyle,2019-09-21,Emily,2019-08-11,Steve washed the dog on the 25th of September. Kyle washed the dog on the 21st of September. Emily washed the dog on the 11th of August. The first person that washed the dog was,2019-08-11,Emily
Ian,2019-08-14,Matt,2019-08-27,Hope,2019-09-10,Ian cleaned the basement on the 14th of August. Matt cleaned the basement on the 27th of August. Hope cleaned the basement on the 10th of September. The first person that cleaned the basement was,2019-08-14,Ian
Connor,2019-08-02,Kyle,2019-09-21,Frank,2019-09-30,Connor arrived in Spain on the 2nd of August. Kyle arrived in Spain on the 21st of September. Frank arrived in Spain on the 30th of September. The first person that arrived in Spain was,2019-08-02,Connor
Frank,2019-09-16,Rose,2019-09-11,Maria,2019-08-26,Frank repotted the plants on the 16th of September. Rose repotted the plants on the 11th of September. Maria repotted the plants on the 26th of August. The first person that repotted the plants was,2019-08-26,Maria
Brandon,2019-08-29,Ian,2019-08-18,Connor,2019-08-02,Brandon arrived in the US on the 29th of August. Ian arrived in the US on the 18th of August. Connor arrived in the US on the 2nd of August. The first person that arrived in the US was,2019-08-02,Connor
Grant,2019-09-25,Connor,2019-08-19,Matt,2019-09-17,Grant filled out the application on the 25th of September. Connor filled out the application on the 19th of August. Matt filled out the application on the 17th of September. The first person that filled out the application was,2019-08-19,Connor
Kevin,2019-08-14,Jerry,2019-09-16,Ian,2019-08-18,Kevin went to an Indian restaurant on the 14th of August. Jerry went to an Indian restaurant on the 16th of September. Ian went to an Indian restaurant on the 18th of August. The first person that went to an Indian restaurant was,2019-08-14,Kevin
Neil,2019-09-22,Maria,2019-08-25,Kevin,2019-08-16,Neil took a bus on the 22nd of September. Maria took a bus on the 25th of August. Kevin took a bus on the 16th of August. The first person that took a bus was,2019-08-16,Kevin
Ryan,2019-08-04,Steve,2019-09-12,Joy,2019-08-09,Ryan arrived in the US on the 4th of August. Steve arrived in the US on the 12th of September. Joy arrived in the US on the 9th of August. The first person that arrived in the US was,2019-08-04,Ryan
Connor,2019-08-17,Maria,2019-08-25,Max,2019-09-01,Connor painted a mural on the 17th of August. Maria painted a mural on the 25th of August. Max painted a mural on the 1st of September. The first person that painted a mural was,2019-08-17,Connor
Steve,2019-08-25,Kevin,2019-08-16,Jerry,2019-09-03,Steve cleaned the shed on the 25th of August. Kevin cleaned the shed on the 16th of August. Jerry cleaned the shed on the 3rd of September. The first person that cleaned the shed was,2019-08-16,Kevin
