name_1,date_1,name_2,date_2,name_3,date_3,context,correct_date,correct_answer
Laura,2019-10-13,Neil,2019-09-20,Aaron,2019-09-02,Laura went to a concert on the 13th of October. Neil went to a concert on the 20th of September. Aaron went to a concert on the 2nd of September. The first person that went to a concert was,2019-09-02,Aaron
Dean,2019-12-09,Emily,2019-12-04,Frank,2019-11-16,Dean went to an Indian restaurant on the 9th of December. Emily went to an Indian restaurant on the 4th of December. Frank went to an Indian restaurant on the 16th of November. The first person that went to an Indian restaurant was,2019-11-16,Frank
Alice,2019-11-10,Alex,2019-12-30,Jason,2019-11-12,Alice attended a wedding on the 10th of November. Alex attended a wedding on the 30th of December. Jason attended a wedding on the 12th of November. The first person that attended a wedding was,2019-11-10,Alice
April,2019-12-27,Maria,2019-11-02,Aaron,2019-11-23,April arrived in Germany on the 27th of December. Maria arrived in Germany on the 2nd of November. Aaron arrived in Germany on the 23rd of November. The first person that arrived in Germany was,2019-11-02,Maria
George,2019-12-24,Walker,2019-11-28,Brandon,2019-12-26,George moved to a new city on the 24th of December. Walker moved to a new city on the 28th of November. Brandon moved to a new city on the 26th of December. The first person that moved to a new city was,2019-11-28,Walker
Mark,2019-12-20,Grant,2019-12-28,Andrew,2019-11-03,Mark received a promotion on the 20th of December. Grant received a promotion on the 28th of December. Andrew received a promotion on the 3rd of November. The first person that received a promotion was,2019-11-03,Andrew
Emily,2019-12-12,Dean,2019-12-01,Hunter,2019-12-10,Emily planted a tree on the 12th of December. Dean planted a tree on the 1st of December. Hunter planted a tree on the 10th of December. The first person that planted a tree was,2019-12-01,Dean
Hope,2019-12-12,Charlie,2019-11-14,Luke,2019-11-18,Hope had a barbecue on the 12th of December. Charlie had a barbecue on the 14th of November. Luke had a barbecue on the 18th of November. The first person that had a barbecue was,2019-11-14,Charlie
Josh,2019-11-14,Jack,2019-11-23,Rachel,2019-11-26,Josh compiled the spreadsheet on the 14th of November. Jack compiled the spreadsheet on the 23rd of November. Rachel compiled the spreadsheet on the 26th of November. The first person that compiled the spreadsheet was,2019-11-14,Josh
Matt,2019-11-29,Ryan,2019-11-04,John,2019-11-20,Matt sold their car on the 29th of November. Ryan sold their car on the 4th of November. John sold their car on the 20th of November. The first person that sold their car was,2019-11-04,Ryan
Martin,2019-12-18,Brandon,2019-11-05,Hunter,2019-11-28,Martin donated blood on the 18th of December. Brandon donated blood on the 5th of November. Hunter donated blood on the 28th of November. The first person that donated blood was,2019-11-05,Brandon
Tyler,2019-12-27,Steve,2019-11-25,Dallas,2019-12-25,Tyler repotted the plants on the 27th of December. Steve repotted the plants on the 25th of November. Dallas repotted the plants on the 25th of December. The first person that repotted the plants was,2019-11-25,Steve
Richard,2019-12-04,Marco,2019-11-06,Ryan,2019-11-24,Richard received a promotion on the 4th of December. Marco received a promotion on the 6th of November. Ryan received a promotion on the 24th of November. The first person that received a promotion was,2019-11-06,Marco
Connor,2019-11-10,Mark,2019-11-29,Michael,2019-11-25,Connor won a contest on the 10th of November. Mark won a contest on the 29th of November. Michael won a contest on the 25th of November. The first person that won a contest was,2019-11-10,Connor
Tyler,2019-12-27,Steve,2019-11-20,Dallas,2019-12-25,Tyler cleaned the garage on the 27th of December. Steve cleaned the garage on the 20th of November. Dallas cleaned the garage on the 25th of December. The first person that cleaned the garage was,2019-11-20,Steve
Dean,2019-12-01,Ryan,2019-11-10,Scott,2019-12-29,Dean washed the dog on the 1st of December. Ryan washed the dog on the 10th of November. Scott washed the dog on the 29th of December. The first person that washed the dog was,2019-11-10,Ryan
Ryan,2019-11-10,Martin,2019-11-05,Hope,2019-12-12,Ryan mowed the lawn on the 10th of November. Martin mowed the lawn on the 5th of November. Hope mowed the lawn on the 12th of December. The first person that mowed the lawn was,2019-11-05,Martin
Richard,2019-11-17,Peter,2019-11-01,Hunter,2019-12-10,Richard sold their car on the 17th of November. Peter sold their car on the 1st of November. Hunter sold their car on the 10th of December. The first person that sold their car was,2019-11-01,Peter
Aaron,2019-12-23,April,2019-12-21,Matt,2019-11-29,Aaron arrived in France on the 23rd of December. April arrived in France on the 21st of December. Matt arrived in France on the 29th of November. The first person that arrived in France was,2019-11-29,Matt
Alice,2019-11-10,Rose,2019-12-25,Jason,2019-11-12,Alice arrived in the UK on the 10th of November. Rose arrived in the UK on the 25th of December. Jason arrived in the UK on the 12th of November. The first person that arrived in the UK was,2019-11-10,Alice
Martin,2019-12-01,Rachel,2019-11-06,Brandon,2019-11-30,Martin won a contest on the 1st of December. Rachel won a contest on the 6th of November. Brandon won a contest on the 30th of November. The first person that won a contest was,2019-11-06,Rachel
Mark,2019-11-10,Peter,2019-11-01,Dallas,2019-12-25,Mark watched a movie on the 10th of November. Peter watched a movie on the 1st of November. Dallas watched a movie on the 25th of December. The first person that watched a movie was,2019-11-01,Peter
Matt,2019-11-29,Rose,2019-12-25,Mark,2019-12-20,Matt went to an Indian restaurant on the 29th of November. Rose went to an Indian restaurant on the 25th of December. Mark went to an Indian restaurant on the 20th of December. The first person that went to an Indian restaurant was,2019-11-29,Matt
Connor,2019-12-14,Josh,2019-12-18,Brandon,2019-12-12,Connor had a barbecue on the 14th of December. Josh had a barbecue on the 18th of December. Brandon had a barbecue on the 12th of December. The first person that had a barbecue was,2019-12-12,Brandon
Dean,2019-12-14,Scott,2019-12-29,Kevin,2019-11-07,Dean got a birthday gift on the 14th of December. Scott got a birthday gift on the 29th of December. Kevin got a birthday gift on the 7th of November. The first person that got a birthday gift was,2019-11-07,Kevin
Rose,2019-11-15,Steve,2019-12-06,Ryan,2019-11-10,Rose cleaned the windows on the 15th of November. Steve cleaned the windows on the 6th of December. Ryan cleaned the windows on the 10th of November. The first person that cleaned the windows was,2019-11-10,Ryan
Maria,2019-11-02,Neil,2019-11-18,Rose,2019-12-25,Maria visited a new country on the 2nd of November. Neil visited a new country on the 18th of November. Rose visited a new country on the 25th of December. The first person that visited a new country was,2019-11-02,Maria
Richard,2019-12-29,Jason,2019-11-05,Steve,2019-12-07,Richard painted a portrait on the 29th of December. Jason painted a portrait on the 5th of November. Steve painted a portrait on the 7th of December. The first person that painted a portrait was,2019-11-05,Jason
Rachel,2019-11-26,Emily,2019-12-20,Brandon,2019-11-05,Rachel repaired the bike on the 26th of November. Emily repaired the bike on the 20th of December. Brandon repaired the bike on the 5th of November. The first person that repaired the bike was,2019-11-05,Brandon
Martin,2019-11-09,Brandon,2019-12-12,Jason,2019-11-05,Martin attended a graduation on the 9th of November. Brandon attended a graduation on the 12th of December. Jason attended a graduation on the 5th of November. The first person that attended a graduation was,2019-11-05,Jason
Alex,2019-12-15,Blake,2019-12-20,Martin,2019-11-09,Alex left for vacation on the 15th of December. Blake left for vacation on the 20th of December. Martin left for vacation on the 9th of November. The first person that left for vacation was,2019-11-09,Martin
Joy,2019-12-26,Frank,2019-11-16,Connor,2019-11-10,Joy repotted the plants on the 26th of December. Frank repotted the plants on the 16th of November. Connor repotted the plants on the 10th of November. The first person that repotted the plants was,2019-11-10,Connor
Max,2019-11-16,Walker,2019-11-23,Emily,2019-12-30,Max went to the gym on the 16th of November. Walker went to the gym on the 23rd of November. Emily went to the gym on the 30th of December. The first person that went to the gym was,2019-11-16,Max
Mark,2019-11-29,Michael,2019-11-07,Aaron,2019-12-23,Mark got a manicure on the 29th of November. Michael got a manicure on the 7th of November. Aaron got a manicure on the 23rd of December. The first person that got a manicure was,2019-11-07,Michael
Joy,2019-12-07,Fred,2019-11-08,Josh,2019-12-18,Joy painted a mural on the 7th of December. Fred painted a mural on the 8th of November. Josh painted a mural on the 18th of December. The first person that painted a mural was,2019-11-08,Fred
Richard,2019-11-17,Dallas,2019-11-07,Brandon,2019-12-12,Richard alphabetized the bookshelf on the 17th of November. Dallas alphabetized the bookshelf on the 7th of November. Brandon alphabetized the bookshelf on the 12th of December. The first person that alphabetized the bookshelf was,2019-11-07,Dallas
Emily,2019-12-20,Aaron,2019-11-23,Peter,2019-11-01,Emily sold their car on the 20th of December. Aaron sold their car on the 23rd of November. Peter sold their car on the 1st of November. The first person that sold their car was,2019-11-01,Peter
Tyler,2019-11-05,Martin,2019-11-21,Mark,2019-11-29,Tyler threw a party on the 5th of November. Martin threw a party on the 21st of November. Mark threw a party on the 29th of November. The first person that threw a party was,2019-11-05,Tyler
Alice,2019-12-07,Ian,2019-11-15,Ryan,2019-11-04,Alice went to a Thai restaurant on the 7th of December. Ian went to a Thai restaurant on the 15th of November. Ryan went to a Thai restaurant on the 4th of November. The first person that went to a Thai restaurant was,2019-11-04,Ryan
Alex,2019-12-18,Rose,2019-12-14,Matt,2019-12-04,Alex ran a marathon on the 18th of December. Rose ran a marathon on the 14th of December. Matt ran a marathon on the 4th of December. The first person that ran a marathon was,2019-12-04,Matt
Brandon,2019-11-30,Charlie,2019-11-06,Alex,2019-12-30,Brandon painted a portrait on the 30th of November. Charlie painted a portrait on the 6th of November. Alex painted a portrait on the 30th of December. The first person that painted a portrait was,2019-11-06,Charlie
Michael,2019-11-07,Andrew,2019-11-03,April,2019-12-21,Michael arrived in France on the 7th of November. Andrew arrived in France on the 3rd of November. April arrived in France on the 21st of December. The first person that arrived in France was,2019-11-03,Andrew
Rose,2019-12-25,Michael,2019-11-07,Mark,2019-12-17,Rose arrived in France on the 25th of December. Michael arrived in France on the 7th of November. Mark arrived in France on the 17th of December. The first person that arrived in France was,2019-11-07,Michael
Josh,2019-11-14,Neil,2019-12-22,Hope,2019-11-13,Josh took a ferry on the 14th of November. Neil took a ferry on the 22nd of December. Hope took a ferry on the 13th of November. The first person that took a ferry was,2019-11-13,Hope
Brandon,2019-12-12,Fred,2019-11-08,Martin,2019-12-18,Brandon took a train on the 12th of December. Fred took a train on the 8th of November. Martin took a train on the 18th of December. The first person that took a train was,2019-11-08,Fred
Brandon,2019-12-26,Joy,2019-12-30,Ryan,2019-11-24,Brandon went fishing on the 26th of December. Joy went fishing on the 30th of December. Ryan went fishing on the 24th of November. The first person that went fishing was,2019-11-24,Ryan
John,2019-11-30,Dallas,2019-12-25,Alex,2019-12-03,John watched a movie on the 30th of November. Dallas watched a movie on the 25th of December. Alex watched a movie on the 3rd of December. The first person that watched a movie was,2019-11-30,John
Walker,2019-11-23,Rose,2019-11-15,Alex,2019-12-03,Walker repotted the plants on the 23rd of November. Rose repotted the plants on the 15th of November. Alex repotted the plants on the 3rd of December. The first person that repotted the plants was,2019-11-15,Rose
Neil,2019-12-30,Jack,2019-12-29,Mark,2019-11-30,Neil cleaned the attic on the 30th of December. Jack cleaned the attic on the 29th of December. Mark cleaned the attic on the 30th of November. The first person that cleaned the attic was,2019-11-30,Mark
Hunter,2019-11-28,Mark,2019-11-29,Brandon,2019-12-25,Hunter called a friend on the 28th of November. Mark called a friend on the 29th of November. Brandon called a friend on the 25th of December. The first person that called a friend was,2019-11-28,Hunter
Charlie,2019-12-23,Neil,2019-12-22,Brandon,2019-11-05,Charlie watched TV on the 23rd of December. Neil watched TV on the 22nd of December. Brandon watched TV on the 5th of November. The first person that watched TV was,2019-11-05,Brandon
Rachel,2019-12-14,Max,2019-11-16,Martin,2019-12-01,Rachel arrived in the UK on the 14th of December. Max arrived in the UK on the 16th of November. Martin arrived in the UK on the 1st of December. The first person that arrived in the UK was,2019-11-16,Max
Jason,2019-11-22,Martin,2019-11-09,Walker,2019-12-20,Jason donated toys on the 22nd of November. Martin donated toys on the 9th of November. Walker donated toys on the 20th of December. The first person that donated toys was,2019-11-09,Martin
Matt,2019-11-29,Blake,2019-12-21,Rose,2019-11-02,Matt cleaned the attic on the 29th of November. Blake cleaned the attic on the 21st of December. Rose cleaned the attic on the 2nd of November. The first person that cleaned the attic was,2019-11-02,Rose
Charlie,2019-12-23,Michael,2019-11-25,Robert,2019-12-02,Charlie cooked lasagna on the 23rd of December. Michael cooked lasagna on the 25th of November. Robert cooked lasagna on the 2nd of December. The first person that cooked lasagna was,2019-11-25,Michael
Richard,2019-11-17,Martin,2019-11-09,Ryan,2019-11-24,Richard returned from vacation on the 17th of November. Martin returned from vacation on the 9th of November. Ryan returned from vacation on the 24th of November. The first person that returned from vacation was,2019-11-09,Martin
Rose,2019-12-14,Aaron,2019-12-23,Laura,2019-11-19,Rose painted a portrait on the 14th of December. Aaron painted a portrait on the 23rd of December. Laura painted a portrait on the 19th of November. The first person that painted a portrait was,2019-11-19,Laura
Brandon,2019-12-26,Michael,2019-11-07,Alice,2019-12-07,Brandon renovated the kitchen on the 26th of December. Michael renovated the kitchen on the 7th of November. Alice renovated the kitchen on the 7th of December. The first person that renovated the kitchen was,2019-11-07,Michael
Rose,2019-11-02,Walker,2019-11-23,George,2019-12-24,Rose visited a new city on the 2nd of November. Walker visited a new city on the 23rd of November. George visited a new city on the 24th of December. The first person that visited a new city was,2019-11-02,Rose
Martin,2019-11-29,Steve,2019-12-06,Connor,2019-11-10,Martin passed an exam on the 29th of November. Steve passed an exam on the 6th of December. Connor passed an exam on the 10th of November. The first person that passed an exam was,2019-11-10,Connor
Ryan,2019-11-24,Grant,2019-12-28,Bob,2019-12-23,Ryan repaired the bike on the 24th of November. Grant repaired the bike on the 28th of December. Bob repaired the bike on the 23rd of December. The first person that repaired the bike was,2019-11-24,Ryan
Charlie,2019-11-14,Jack,2019-12-30,Laura,2019-12-16,Charlie attended a wedding on the 14th of November. Jack attended a wedding on the 30th of December. Laura attended a wedding on the 16th of December. The first person that attended a wedding was,2019-11-14,Charlie
Mark,2019-11-29,Kevin,2019-11-07,Max,2019-11-01,Mark called a friend on the 29th of November. Kevin called a friend on the 7th of November. Max called a friend on the 1st of November. The first person that called a friend was,2019-11-01,Max
Frank,2019-11-16,Ryan,2019-11-06,Emily,2019-12-04,Frank had a picnic on the 16th of November. Ryan had a picnic on the 6th of November. Emily had a picnic on the 4th of December. The first person that had a picnic was,2019-11-06,Ryan
Dallas,2019-11-07,Rose,2019-11-02,Frank,2019-11-16,Dallas took a train on the 7th of November. Rose took a train on the 2nd of November. Frank took a train on the 16th of November. The first person that took a train was,2019-11-02,Rose
Martin,2019-11-05,Neil,2019-12-22,Dean,2019-12-09,Martin went fishing on the 5th of November. Neil went fishing on the 22nd of December. Dean went fishing on the 9th of December. The first person that went fishing was,2019-11-05,Martin
John,2019-11-30,Jack,2019-11-11,Blake,2019-11-21,John bought a new car on the 30th of November. Jack bought a new car on the 11th of November. Blake bought a new car on the 21st of November. The first person that bought a new car was,2019-11-11,Jack
Kyle,2019-11-11,Robert,2019-12-02,Max,2019-11-16,Kyle compiled the spreadsheet on the 11th of November. Robert compiled the spreadsheet on the 2nd of December. Max compiled the spreadsheet on the 16th of November. The first person that compiled the spreadsheet was,2019-11-11,Kyle
Scott,2019-12-29,Rose,2019-11-06,Richard,2019-11-17,Scott visited a new country on the 29th of December. Rose visited a new country on the 6th of November. Richard visited a new country on the 17th of November. The first person that visited a new country was,2019-11-06,Rose
Rachel,2019-11-06,Alex,2019-12-03,Grant,2019-11-26,Rachel renovated the bathroom on the 6th of November. Alex renovated the bathroom on the 3rd of December. Grant renovated the bathroom on the 26th of November. The first person that renovated the bathroom was,2019-11-06,Rachel
Grant,2019-11-26,Connor,2019-11-19,George,2019-12-24,Grant renovated the kitchen on the 26th of November. Connor renovated the kitchen on the 19th of November. George renovated the kitchen on the 24th of December. The first person that renovated the kitchen was,2019-11-19,Connor
Dean,2019-12-14,John,2019-11-20,Steve,2019-11-25,Dean refinanced the mortgage on the 14th of December. John refinanced the mortgage on the 20th of November. Steve refinanced the mortgage on the 25th of November. The first person that refinanced the mortgage was,2019-11-20,John
Walker,2019-12-20,Charlie,2019-12-23,Connor,2019-11-19,Walker cleaned the garage on the 20th of December. Charlie cleaned the garage on the 23rd of December. Connor cleaned the garage on the 19th of November. The first person that cleaned the garage was,2019-11-19,Connor
Laura,2019-12-16,Hope,2019-12-12,Charlie,2019-11-06,Laura got surgery on the 16th of December. Hope got surgery on the 12th of December. Charlie got surgery on the 6th of November. The first person that got surgery was,2019-11-06,Charlie
Grant,2019-11-22,Brandon,2019-12-26,Mark,2019-11-29,Grant took a walk in the park on the 22nd of November. Brandon took a walk in the park on the 26th of December. Mark took a walk in the park on the 29th of November. The first person that took a walk in the park was,2019-11-22,Grant
Ryan,2019-11-10,Peter,2019-11-30,Emily,2019-12-04,Ryan reorganized the closet on the 10th of November. Peter reorganized the closet on the 30th of November. Emily reorganized the closet on the 4th of December. The first person that reorganized the closet was,2019-11-10,Ryan
Henry,2019-12-05,April,2019-12-27,Neil,2019-11-18,Henry washed the floors on the 5th of December. April washed the floors on the 27th of December. Neil washed the floors on the 18th of November. The first person that washed the floors was,2019-11-18,Neil
Rachel,2019-11-06,Steve,2019-11-20,Josh,2019-11-14,Rachel cleaned the garage on the 6th of November. Steve cleaned the garage on the 20th of November. Josh cleaned the garage on the 14th of November. The first person that cleaned the garage was,2019-11-06,Rachel
Jason,2019-11-28,Martin,2019-11-21,George,2019-12-24,Jason had a barbecue on the 28th of November. Martin had a barbecue on the 21st of November. George had a barbecue on the 24th of December. The first person that had a barbecue was,2019-11-21,Martin
Jack,2019-12-29,Henry,2019-12-13,Brandon,2019-12-26,Jack went to the gym on the 29th of December. Henry went to the gym on the 13th of December. Brandon went to the gym on the 26th of December. The first person that went to the gym was,2019-12-13,Henry
Joy,2019-12-30,Emily,2019-12-20,Dallas,2019-12-25,Joy received a promotion on the 30th of December. Emily received a promotion on the 20th of December. Dallas received a promotion on the 25th of December. The first person that received a promotion was,2019-12-20,Emily
Laura,2019-11-22,April,2019-11-09,Ryan,2019-11-24,Laura went to a French restaurant on the 22nd of November. April went to a French restaurant on the 9th of November. Ryan went to a French restaurant on the 24th of November. The first person that went to a French restaurant was,2019-11-09,April
Neil,2019-11-18,Henry,2019-12-05,Fred,2019-11-08,Neil watered the plants on the 18th of November. Henry watered the plants on the 5th of December. Fred watered the plants on the 8th of November. The first person that watered the plants was,2019-11-08,Fred
Connor,2019-11-10,Richard,2019-12-04,Peter,2019-11-01,Connor arrived in France on the 10th of November. Richard arrived in France on the 4th of December. Peter arrived in France on the 1st of November. The first person that arrived in France was,2019-11-01,Peter
Leon,2019-02-17,Rose,2019-03-31,Neil,2019-03-04,Leon cleaned the garage on the 17th of February. Rose cleaned the garage on the 31st of March. Neil cleaned the garage on the 4th of March. The first person that cleaned the garage was,2019-02-17,Leon
Aaron,2019-02-08,Neil,2019-02-23,Fred,2019-03-07,Aaron went to an Indian restaurant on the 8th of February. Neil went to an Indian restaurant on the 23rd of February. Fred went to an Indian restaurant on the 7th of March. The first person that went to an Indian restaurant was,2019-02-08,Aaron
Kevin,2019-03-12,George,2019-03-01,Rose,2019-02-21,Kevin cooked lasagna on the 12th of March. George cooked lasagna on the 1st of March. Rose cooked lasagna on the 21st of February. The first person that cooked lasagna was,2019-02-21,Rose
Emily,2019-03-17,Scott,2019-02-01,Rachel,2019-03-06,Emily filled out the application on the 17th of March. Scott filled out the application on the 1st of February. Rachel filled out the application on the 6th of March. The first person that filled out the application was,2019-02-01,Scott
Kevin,2019-03-12,Richard,2019-02-20,Ryan,2019-02-13,Kevin received a letter on the 12th of March. Richard received a letter on the 20th of February. Ryan received a letter on the 13th of February. The first person that received a letter was,2019-02-13,Ryan
Fred,2019-03-03,Robert,2019-02-26,Rose,2019-03-22,Fred won the lottery on the 3rd of March. Robert won the lottery on the 26th of February. Rose won the lottery on the 22nd of March. The first person that won the lottery was,2019-02-26,Robert
Walker,2019-02-20,Ryan,2019-02-23,Joy,2019-03-20,Walker got a massage on the 20th of February. Ryan got a massage on the 23rd of February. Joy got a massage on the 20th of March. The first person that got a massage was,2019-02-20,Walker
Scott,2019-03-16,Walker,2019-02-06,Robert,2019-02-26,Scott took a boat on the 16th of March. Walker took a boat on the 6th of February. Robert took a boat on the 26th of February. The first person that took a boat was,2019-02-06,Walker
Jerry,2019-03-16,Blake,2019-03-01,Robert,2019-02-26,Jerry arrived in France on the 16th of March. Blake arrived in France on the 1st of March. Robert arrived in France on the 26th of February. The first person that arrived in France was,2019-02-26,Robert
Alice,2019-02-22,Hunter,2019-02-05,Rachel,2019-03-01,Alice won a contest on the 22nd of February. Hunter won a contest on the 5th of February. Rachel won a contest on the 1st of March. The first person that won a contest was,2019-02-05,Hunter
Ian,2019-02-14,Frank,2019-02-20,Richard,2019-02-05,Ian went hiking on the 14th of February. Frank went hiking on the 20th of February. Richard went hiking on the 5th of February. The first person that went hiking was,2019-02-05,Richard
Josh,2019-02-27,Henry,2019-03-06,Scott,2019-02-01,Josh won a contest on the 27th of February. Henry won a contest on the 6th of March. Scott won a contest on the 1st of February. The first person that won a contest was,2019-02-01,Scott
Fred,2019-03-07,Martin,2019-03-26,Rose,2019-03-22,Fred called a friend on the 7th of March. Martin called a friend on the 26th of March. Rose called a friend on the 22nd of March. The first person that called a friend was,2019-03-07,Fred
Fred,2019-02-01,John,2019-03-21,Henry,2019-03-06,Fred harvested a garden on the 1st of February. John harvested a garden on the 21st of March. Henry harvested a garden on the 6th of March. The first person that harvested a garden was,2019-02-01,Fred
Robert,2019-02-11,Neil,2019-03-04,Jason,2019-02-12,Robert painted a mural on the 11th of February. Neil painted a mural on the 4th of March. Jason painted a mural on the 12th of February. The first person that painted a mural was,2019-02-11,Robert
Rose,2019-03-22,Steve,2019-02-03,Neil,2019-02-23,Rose got a haircut on the 22nd of March. Steve got a haircut on the 3rd of February. Neil got a haircut on the 23rd of February. The first person that got a haircut was,2019-02-03,Steve
